Column,id,title,publication,date
60326,82591,Fire tears through Dubai luxury hotel near planned fireworks show,Fox News,2015-12-31
60327,82593,Top Carson campaign staffers resign,Fox News,2015-12-31
60328,82594,Democrat Martin O’Malley fails to qualify for Ohio’s primary ballot,Fox News,2015-12-31
60329,82595,"Brawl breaks out in GOP race, below the Trump tier",Fox News,2015-12-30
60330,82596,Donald Trump blasts Bill Clinton as ’one of the great abusers of the world’,Fox News,2015-12-30
60331,82597,German police clear two train stations due to ’imminent threat’ of terror attack,Fox News,2015-12-31
60332,82598,"Security tight as terror threat looms over New York, Los Angeles New Year’s celebrations",Fox News,2015-12-30
60333,82599,Revelers ring in the new year despite fears of attacks,Fox News,2015-12-31
60334,82600,"Drop in oil prices rocks producer states, triggers historic tax hike plan in Alaska",Fox News,2016-01-01
60335,82602,U.S. Oil Prices End 2015 Down 30% for the Year,Fox News,2015-12-31
60336,82603,Obama to meet Monday with AG Lynch about ’options’ to tighten gun laws,Fox News,2016-01-01
60337,82604,"Open Carry law takes effect in Texas, but activists keep fighting",Fox News,2016-01-01
60338,82605,Open carry comes to Texas: Why the Lone Star state will be safer in 2016,Fox News,2015-12-30
60339,82606,Mississippi River tops levee in southern Illinois,Fox News,2016-01-01
60340,82607,Missing Illinois teen’s last text: ’Help’,Fox News,2016-01-01
60341,82608,"Pennsylvania boy, 5, vanishes from party without coat, shoes",Fox News,2016-01-01
60342,82609,Cops hunt for driver after Minneapolis woman killed in hit-and-run,Fox News,2016-01-01
60343,82610,"House GOP: First task sending White House bill repealing ObamaCare, defunding Planned Parenthood",Fox News,2016-01-02
60344,82612,"Iran, Germany, Middle East Muslim leaders condemn Saudi Arabia’s execution of prominent Shiite cleric",Fox News,2016-01-02
60345,82613,"Revered Shiite cleric in Saudi Arabia has death sentence upheld on appeal, brother says",Fox News,2015-10-25
60346,82614,"Saudi court sentences iconic Shiite cleric to death, sparking fears of unrest in kingdom",Fox News,2014-10-15
60347,82615,"St. Louis-area residents face massive cleanup, recovery",Fox News,2016-01-02
60348,82616,Governors tour flooded areas amid threat to more homes,Fox News,2016-01-02
60349,82617,Hotel worker: ’Affluenza’ teen woke mom to pay strip club bar bill in Mexico,Fox News,2016-01-02
60350,82618,"Saudi Arabia cuts ties with Iran, foreign minister says",Fox News,2016-01-03
60351,82620,Iran’s supreme leader warns Saudi Arabia of ’divine revenge’ for cleric’s execution,Fox News,2016-01-03
60352,82621,GOP field rips Obama’s move toward executive action to tighten gun control laws,Fox News,2016-01-03
60353,82622,Trump brushes off Islamic militant group’s recruiting video that cites his words,Fox News,2016-01-03
60354,82623,Low-polling 2016 presidential candidates insist their campaigns are still in the mix ,Fox News,2016-01-03
60355,82624,Armed protesters in Oregon land fight give demands as ranchers head to prison,Fox News,2016-01-04
60356,82625,Nevada sheriff says Cliven Bundy must be held accountable for standoff,Fox News,2014-07-05
60357,82626,Atlanta girl shot during robbery for her hoverboard,Fox News,2016-01-03
60358,82627,Police arrest man with weapons cache in car before NHL Winter Classic,Fox News,2016-01-02
60359,82628,Obama executive action on guns to require background checks for more sales,Fox News,2016-01-04
60360,82630,President Obama wants to disarm America,Fox News,2016-01-04
60361,82631,"Rancher family reports to prison, does not endorse Oregon siege",Fox News,2016-01-04
60362,82633,US under pressure to assure Mideast allies amid Iran-Saudi dispute,Fox News,2016-01-04
60363,82634,Sunni vs. Shia: A rivalry as old as Islam,Fox News,2016-01-04
60364,82635,US reportedly fears Iran-Saudi Arabia rift will set back ISIS fight,Fox News,2016-01-03
60365,82636,Saudi Arabia says Iran must act ’normal’ as allies scale back ties to Tehran,Fox News,2016-01-04
60366,82637,Our Shia Problem,Fox News,2016-01-04
60367,82638,Body of country singer Craig Strickland found after days of searching,Fox News,2016-01-04
60368,82639,Country music’s saddest stories of 2015,Fox News,2015-12-22
60369,82640,Searchers find 3rd body in Wisconsin lake after canoe accident; 1 remains missing ,Fox News,2016-01-04
60370,82641,"Ripe for radicalization: Federal prisons ’breeding ground’ for terrorists, say experts",Fox News,2016-01-05
60371,82643,"Wanted British terrorist reportedly sold bounce houses, then joined ISIS",Fox News,2016-01-05
60372,82644,Roman Catholic priest freed from militant captivity in Syria,Fox News,2016-01-05
60373,82645,"French president honors victims of Charlie Hebdo, kosher market attacks",Fox News,2016-01-05
60374,82646,"ISIS has 50 British children under its control, report finds",Fox News,2016-01-05
60375,82647,Official: Child in grisly ISIS video should be taken from parents if family returns to Britain,Fox News,2016-01-05
60376,82648,"Obama announces gun control actions, expands background checks",Fox News,2016-01-05
60377,82649,Obama’s gun control actions open legal can of worms,Fox News,2016-01-05
60378,82650,ATF guidance on who qualifies as a firearms dealer,Fox News,2016-01-05
60379,82651,Obama’s small ball on guns could be a big deal,Fox News,2016-01-05
60380,82652,"Universal background checks do little to stop mass shootings, study finds",Fox News,2016-01-05
60381,82653,Martha MacCallum: Gun violence and tears for lost children,Fox News,2016-01-05
60382,82654,Judge Napolitano: Why Obama’s executive action on guns is unconstitutional,Fox News,2016-01-05
60383,82655,More than a dozen US troops trapped amid Afghanistan firefight,Fox News,2016-01-05
60384,82656,Afghan police refuse to return to embattled district to fight Taliban,Fox News,2015-12-29
60385,82657,"Pentagon pushing for long-term US presence at Bagram, as Taliban gain ground",Fox News,2015-12-28
60386,82658,Singer Craig Strickland made it out of lake before succumbing to hypothermia,Fox News,2016-01-05
60387,82659,Bodies found in search for missing ’EastEnders’ actress and her children,Fox News,2016-01-05
60388,82660,Missing Texas mom found dead after car plunged into ravine,Fox News,2016-01-05
60389,82661,Congress sends health law repeal to Obama’s desk for first time,Fox News,2016-01-06
60390,82663,"Pentagon begins wave of Gitmo transfers, sends 2 detainees to Ghana",Fox News,2016-01-06
60391,82664,Source: ’Al Qaeda followers’ among 17 being transferred from Gitmo,Fox News,2016-01-04
60392,82665,Alabama top justice tells judges not to issue gay marriage licenses,Fox News,2016-01-06
60393,82666,Kentucky gov removes names of county clerks from marriage licenses,Fox News,2015-12-23
60394,82667,Anglicans Fearing Permanent Split Over Gay Marriage as Bishops Threaten to Walk Out,Fox News,2016-01-05
60395,82668,"Ken Griffey Jr., Mike Piazza elected to the National Baseball Hall of Fame",Fox News,2016-01-06
60396,82669,"US student visa program’s ’many vulnerabilities’ raise spying, terror fears",Fox News,2016-01-07
60397,82671,Public school recruits students to work for Hillary Clinton campaign,Fox News,2016-01-07
60398,82672,"Recordings reveal Qaddafi foretold rise of radical Islam, Euro invasion",Fox News,2016-01-07
60399,82673,"Libya truck bomb kills at least 60 policemen, wounds 200",Fox News,2016-01-07
60400,82674,ISIS Attacks On Libya Oil Tanks Fuel Supply Concerns: DJ,Fox News,2016-01-06
60401,82675,Wall Street Plunges as Volatily Grips Global Markets,Fox News,2016-01-07
60402,82676,"Market Turmoil: Don’t Panic, There’s Always Something",Fox News,2016-01-07
60403,82677,Investors Race to Gold Amid Global Turmoil,Fox News,2016-01-07
60404,82678,Oil Prices Finish Below $34,Fox News,2016-01-07
60405,82679,Fox News Poll:  Sanders up by 13 points in New Hampshire,Fox News,2016-01-08
60406,82681,"Fox News Poll: Cruz, Trump remain top GOP picks in Iowa",Fox News,2016-01-08
60407,82682,Fox News Poll: Majorities say Obama has mostly failed on top issues,Fox News,2016-01-08
60408,82683,Fox News Poll: Trump holds commanding lead in New Hampshire,Fox News,2016-01-08
60409,82684,"Eligibility questions causing headaches for Cruz camp, as McCain piles on",Fox News,2016-01-08
60410,82685,US eyes Saudi-Iran feud for impact on oil,Fox News,2016-01-08
60411,82686,Iran: Saudi Arabia must choose between hatred or stability,Fox News,2016-01-08
60412,82688,Fugitive drug kingpin ’El Chapo’ caught in Mexico 6 months after prison escape,Fox News,2016-01-08
60413,82689,Key dates in Mexico’s pursuit of drug lord ’El Chapo’ Guzman,Fox News,2016-01-08
60414,82690,183-year-old giant tortoise gets new lease on life thanks to healthier diet,Fox News,2016-01-08
60415,82691,Two ’extinct’ snakes spotted swimming off Australia’s coast,Fox News,2015-12-23
60416,82692,"In perfect Lassie fashion, dog leads cops to injured canine pal",Fox News,2016-01-08
60417,82693,Protests in Cologne after assaults; Merkel pledges new laws,Fox News,2016-01-09
60418,82695,Sanders calls Bill Clinton’s affair ’totally disgraceful and unacceptable’,Fox News,2016-01-09
60419,82696,Clinton email about non-secure fax re-ignites concerns about her sidestepping security measures,Fox News,2016-01-09
60420,82697,"Fox News Poll: Trump, Cruz top GOP race nationally",Fox News,2016-01-09
60421,82702,"Mexico willing to extradite drug kingpin ’El Chapo’ to US, official says",Fox News,2016-01-09
60422,82703,Report says Playboy Mansion to go on sale for $200M,Fox News,2016-01-09
60423,82704,"Trump says Cruz should resolve citizenship issue, can compete with Clinton",Fox News,2016-01-10
60424,82707,Obama will not endorse candidate in Democratic primary race,Fox News,2016-01-10
60426,82711,"Alleged Pa. cop shooter arraigned, denied bail",Fox News,2016-01-09
60427,82712,Utah fears thousands infected in hepatitis C outbreak after exposure to hospital nurse,Fox News,2016-01-10
60428,82713,Ice cream maker Blue Bell reports listeria found again in facility,Fox News,2016-01-08
60429,82714,Oregon Zoo staff infected by TB after exposure to elephants,Fox News,2016-01-08
60430,82715,"Tuberculosis kills 3, sickens 26 in Alabama",Fox News,2016-01-08
60431,82716,Mountain lion found with unusual deformity,Fox News,2016-01-10
60432,82717,Police dog dies after being shot breaking up burglary,Fox News,2016-01-10
60433,82718,Traffic cam’s stunning images of snowy owl go viral,Fox News,2016-01-09
60434,82719,ISIS burns fighters alive for letting Ramadi fall,Fox News,2016-01-11
60435,82721,ISIS claims responsibility for Baghdad mall siege that left 18 dead,Fox News,2016-01-11
60436,82722,US airstrike in Mosul blows up ’millions’ in ISIS cash,Fox News,2016-01-11
60437,82723,ISIS recruit reportedly lists his job skills on LinkedIn,Fox News,2016-01-11
60438,82724,Jewish teacher reportedly stabbed with machete outside synagogue in France,Fox News,2016-01-11
60439,82725,Obama agenda status report: Did he meet State of the Union goals?,Fox News,2016-01-11
60440,82726,"In State of Union, Obama to leave empty seat to honor gun victims, underscore gun control effort",Fox News,2016-01-10
60441,82727,"Obamas’ guest list for State of the Union includes Syrian refugee, former illegal immigrant",Fox News,2016-01-11
60442,82728,GOP candidate lineup announced for Fox Business Network debate,Fox News,2016-01-11
60443,82729,"Bush super PAC slams Rubio on illegal immigration, amnesty",Fox News,2016-01-11
60444,82730,Ringling circus elephants to retire in May,Fox News,2016-01-11
60445,82732,Elusive dog finally captured after 559-day team effort,Fox News,2016-01-11
60446,82734,US Navy to name ship after hero from Iwo Jima,Fox News,2016-01-12
60447,82735,Officials: ISIS may be testing chemical weapons as terror group rapidly expands,Fox News,2016-01-12
60448,82736,"At least 10 killed, 15 injured in Istanbul explosion, officials say",Fox News,2016-01-11
60449,82737,New York village votes to keep logo criticized as racist,Fox News,2016-01-12
60450,82738,Philly high schooler gets lesson in hate after penning column on Missouri race friction,Fox News,2016-01-08
60451,82739,Maine Gov. LePage apologizes for controversial remarks,Fox News,2016-01-09
60452,82740,Legacy on the line as Obama delivers final State of the Union address,Fox News,2016-01-12
60453,82741,DHS Secretary Jeh Johnson designated Cabinet member ’survivor’ for State of the Union,Fox News,2016-01-12
60454,82743,Live Blog: State of the Union 2016,Fox News,2016-01-12
60455,82744,"Hollywood stars follow Obama’s gun control script, tweeting White House talking points on cue",Fox News,2016-01-13
60456,82746,NRA chief challenges Obama to debate on guns,Fox News,2016-01-14
60457,82747,What Obama didn’t say: SOTU glosses over trouble spots,Fox News,2016-01-13
60458,82748,"DR. MANNY: The US is winning the ’war on cancer,’ but the fight is far from over",Fox News,2016-01-13
60459,82749,"
Iranian footage shows US sailor apology, arrest in Gulf incident
",Fox News,nan
60460,82750,"Iranian footage shows US sailor apology, arrest in Gulf incident",Fox News,2016-01-13
60461,82751,"Kerry says release of US sailors ’testament’ to Iran diplomacy, nuke deal going forward",Fox News,2016-01-13
60462,82752,Iran releases 10 US Navy sailors after boat drifted in Persian Gulf,Fox News,2016-01-13
60463,82753,Supreme Court justices seem divided over Iran payment to terror victims,Fox News,2016-01-13
60464,82754,Buccaneer bones: Possible pirate skeleton found under Scotland schoolyard,Fox News,2016-01-13
60465,82755,Ocean search for wreckage of Malaysia Airlines Flight 370 finds 2nd shipwreck,Fox News,2016-01-13
60466,82756,Fiorina knocks Clinton’s tech IQ: ’You cannot wipe a server with a towel’,Fox News,2016-01-14
60467,82757,Match Play: Power pairings for tonight’s Fox Business debate,Fox News,2016-01-14
60468,82758,South Carolina: Gateway to the 2016 Republican nomination,Fox News,2016-01-14
60469,82759,Carter says ‘navigation error’ – not mechanical problem – put US boats in Iranian waters,Fox News,2016-01-14
60470,82760,"Why 2016 will be most negative, nasty presidential campaign in modern American history",Fox News,2016-01-14
60471,82761,Place where Salem ’witches’ were executed is found,Fox News,2016-01-14
60472,82762,Dow plummets more than 500 points as oil prices sink,Fox News,2016-01-15
60473,82764,"Growing number of police chiefs, sheriffs join call to arms",Fox News,2016-01-15
60474,82765,Fact Check: Christie denies Rubio claim on Sotomayor support – who’s right?,Fox News,2016-01-15
60475,82766,Gloves off for top tier in GOP race after debate,Fox News,2016-01-15
60476,82767,"Trump, Cruz clash over eligibility, ‘New York values’ at GOP debate",Fox News,2016-01-15
60477,82768,"With Sunday debate, DNC places NFL, ’Downton Abbey’ fans in tough spot",Fox News,2016-01-15
60478,82769,"
Gloves off for top tier in GOP race after debate
",Fox News,nan
60479,82770,"Ex-Green Beret, UFC fighter Tim Kennedy reportedly working with authorities over ISIS threats",Fox News,2016-01-15
60480,82771,"ISIS in Syria paid for Jakarta attack, new sign of its massive reach",Fox News,2016-01-15
60481,82772,Former Dutch soldier arrested for fighting Islamic State,Fox News,2016-01-15
60482,82773,American missionary killed in Burkina Faso attack by Al Qaeda-linked militants,Fox News,2016-01-17
60483,82775,"At Tea Party rally in South Carolina, top GOP candidates make pitch for support",Fox News,2016-01-17
60484,82777,"Kerry says Iran has completed steps in nuclear deal, ’First day of a safer world’",Fox News,2016-01-17
60485,82778,"Republicans on Capitol Hill, campaign trail joyful about prisoner release, still upset about Iran nuclear deal",Fox News,2016-01-16
60486,82779,"Time waits for no one, including members of Congress",Fox News,2016-01-16
60487,82780,Man who attacked Uber driver in viral video decides to sue,Fox News,2016-01-16
60488,82781,Americans reported kidnapped from Baghdad ’brothel’ named,Fox News,2016-01-18
60489,82783,"Iraq sends troops south to rein in crime, tribal disputes",Fox News,2016-01-17
60490,82784,"Iraqi city of Ramadi, once home to 500,000, lies in ruins",Fox News,2016-01-17
60491,82785,Clinton’s ’no individual too big to jail’ tweet backfires,Fox News,2016-01-17
60492,82786,"Clinton embraces Obama in final stretch, fueling GOP claims of seeking ’3rd term’",Fox News,2016-01-18
60493,82787,"Clinton sharpens tone at last debate before Iowa, Sanders claims ‘momentum’   ",Fox News,2016-01-17
60494,82788,AP Fact Check: Democratic debaters and the facts,Fox News,2016-01-17
60495,82789,Clinton defends Obama decision to back off Syria ’red line’,Fox News,2016-01-17
60496,82790,Sanders proposes tax hike to pay for universal health care,Fox News,2016-01-17
60497,82791,"Christian mothers, wives take up the fight against ISIS, whose women serve as suicide bombers and slaves",Fox News,2016-01-18
60498,82792,"At least 300 killed in Islamic State ’massacre’ in Syrian city, state media says",Fox News,2016-01-17
60499,82793,Malaysia man arrested hours before planning to commit terror atrocity,Fox News,2016-01-17
60500,82794,Video shows US airstrikes obliterating Islamic State cash stockpile in Mosul,Fox News,2016-01-16
60501,82795,Murder-suicide suspected in deaths of 3 near SUNY Geneseo campus,Fox News,2016-01-18
60502,82796,"Ohio man accused of targeting, killing cop had long criminal record",Fox News,2016-01-18
60503,82797,Utah police officer killed Sunday had overcome cancer,Fox News,2016-01-18
60504,82798,"Off-duty NYPD cop shoots man during attempted robbery, police say",Fox News,2016-01-18
60505,82801,Hillary vs. Bernie: Clinton clings to Obama to push back against Sanders in heated debate,Fox News,2016-01-18
60506,82804,Trump threatens to abandon Scotland deal as UK debates banning him,Fox News,2016-01-18
60507,82805,Trump looks to appeal to evangelicals at Liberty University,Fox News,2016-01-18
60508,82806,US faces challenge freeing Americans held hostage on Pakistani-Afghan border,Fox News,2016-01-18
60509,82807,American Amir Hekmati released by Iran reunites with family in Germany,Fox News,2016-01-18
60510,82808,Kerry says he was ’infuriated’ by Iran’s footage of detained US sailors,Fox News,2016-01-18
60511,82809,US military releases 1st account of sailors’ Iran detention,Fox News,2016-01-18
60512,82810,Could Obama’s nuke deal unleash Iran’s Apocalyptic Muslims?,Fox News,2016-01-18
60513,82812,Florida declares open season on pythons in annual challenge,Fox News,2016-01-18
60514,82813,Shark found near death in Florida swimming pool,Fox News,2016-01-18
60515,82814,"Glenn Frey, founding member of the Eagles, dead at 67",Fox News,2016-01-18
60516,82815,’American Pie’ singer Don McLean arrested for domestic violence,Fox News,2016-01-18
60517,82816,"Ohio Valley, Northeast brace for Winter Storm ’Jonas’ this weekend",Fox News,2016-01-19
60518,82818,Sarah Palin endorses Donald Trump’s presidential bid,Fox News,2016-01-19
60519,82819,"Inspector General: Clinton emails had intel from most secretive, classified programs",Fox News,2016-01-19
60520,82820,E-mails reveal Clinton aides pushed back against using government email account,Fox News,2016-01-18
60521,82821,"Carson cancels campaign events after fatal car crash involving volunteers, staffer",Fox News,2016-01-19
60522,82822,ISIS confirms death of ’Jihadi John’,Fox News,2016-01-19
60523,82823,"ISIS holding 3,500 Iraqis as slaves, UN report says",Fox News,2016-01-19
60524,82825,US airstrike destroys second site of ISIS cash reserves,Fox News,2016-01-19
60525,82826,"Inside Fallujah: ISIS-held ghost town ruled by fear, paranoia as battle looms",Fox News,2016-01-20
60526,82828,Pentagon: ISIS destruction of Christian monastery is savagery vs. decency,Fox News,2016-01-20
60527,82829,New issue of ISIS magazine Dabiq calls for war on ...Muslims,Fox News,2016-01-20
60528,82830,Another irreplaceable loss for Christianity: ISIS destroys ancient Iraqi monastery,Fox News,2016-01-20
60529,82831,"Will Trump, Cruz battle alienate their mutual supporters?",Fox News,2016-01-20
60530,82832,Will mortgage deduction remain sacred? GOP candidates float changes,Fox News,2016-01-20
60531,82833,Trump’s Palin surprise: An Iowa boost from a fellow reality show star,Fox News,2016-01-20
60532,82834,Prime-time Dem town hall scheduled before Iowa caucuses ,Fox News,2016-01-20
60533,82835,"Palin links son’s arrest to PTSD, Obama policies",Fox News,2016-01-20
60534,82836,Scientists may have just found a ninth planet and it’s massive,Fox News,2016-01-20
60535,82837,Five ’bright’ planets set to align in dawn sky,Fox News,2016-01-19
60536,82838,China speeding up its plans to land on the ’dark side of the moon’,Fox News,2016-01-19
60537,82839,Stunning NASA image shows Pluto’s atmosphere,Fox News,2016-01-18
60538,82840,"Israel warms to Sunni powers, questions US’ Palestinian focus",Fox News,2016-01-21
60539,82842,New issue of ISIS magazine Dabiq calls for war on . . . Muslims,Fox News,2016-01-21
60540,82843,"A look at where countries, regional actors stand in ongoing dispute between Saudi Arabia, Iran",Fox News,2016-01-05
60541,82844,Administration eases visa rules for travelers visiting terror hotspots,Fox News,2016-01-21
60542,82845,DHS admits it’s not deporting most visa overstays,Fox News,2016-01-20
60543,82846,Rep. Meadows: Why visa overstays are a grave national security threat,Fox News,2016-01-21
60544,82847,"Why can’t DC handle snow? Once again, officials hit for storm response",Fox News,2016-01-21
60545,82848,"In advance of big storm, New Jersey lifts licensing laws for shoveling snow",Fox News,2016-01-21
60546,82849,States of emergency declared as East Coast braces for winter storm,Fox News,2016-01-21
60547,82850,"DC has hard time believing winter storm hype – but this time, just maybe ...",Fox News,2016-01-21
60548,82851,Airlines waive fees ahead of potentially historic East Coast storm,Fox News,2016-01-21
60549,82852,World War II veteran to reunite with wartime girlfriend,Fox News,2016-01-20
60550,82853,"Act of Congress lifts ban on Capitol Hill sledding, but police still vow to limit activity in interest of safety",Fox News,2016-01-23
60551,82854,#Blizzard2016: Seven ways snow in Washington is like our government,Fox News,2016-01-22
60552,82855,Historic blizzard on the way? What you need to know if you’re traveling,Fox News,2016-01-22
60553,82856,Report: Bloomberg considering an indepedent 2016 White House bid,Fox News,2016-01-23
60554,82857,"Fox News Poll: Trump, Cruz top GOP race, few have ’birther’ concerns",Fox News,2016-01-22
60555,82858,"Clinton, Rubio score key Iowa paper’s endorsement ahead of caucuses",Fox News,2016-01-23
60556,82859,RNC cuts debate ties with conservative magazine over anti-Trump issue,Fox News,2016-01-22
60557,82860,"As Washington publically frets over storm, GOP worries about impact of Trump, Cruz on Hill majority",Fox News,2016-01-23
60558,82861,University of Virginia student detained after hotel incident in Pyongyang,Fox News,2016-01-23
60559,82862,Good Samaritan killed in NC trying to help motorist stuck in snowstorm,Fox News,2016-01-23
60560,82863,Family pleads for help 10 years after disappearance of Jennifer Kesse,Fox News,2016-01-22
60561,82864,Rubio: Big Iowa newspaper endorsement ‘affirmation’ of campaign’s win-ability ,Fox News,2016-01-24
60562,82866,"Sanders, other 2016 candidates don’t exactly welcome a Bloomberg bid",Fox News,2016-01-24
60563,82867,Trump weighs lawsuit over Cruz citizenship,Fox News,2016-01-24
60564,82868,Billionaire donors help Cruz rise in GOP presidential bid,Fox News,2016-01-24
60565,82869,"Fox News Poll: Trump gains in Iowa, still dominates in New Hampshire",Fox News,2016-01-24
60566,82870,Girls basketball team gets booted from league for being too good,Fox News,2016-01-24
60567,82871,"Shaquille O’Neal surprises Florida teens, officer with game of basketball",Fox News,2016-01-24
60568,82872,Middle school basketball coach resigns for game brawl caught on video,Fox News,2016-01-17
60569,82873,"Gun shop owner, son killed over $25 firearm repair fee, sheriff says",Fox News,2016-01-24
60570,82874,"5-year-old boy killed in Wisconsin shooting, suspect flees",Fox News,2016-01-24
60571,82875,Ex-Wisconsin cop accused of killing 2 women to stand trial,Fox News,2016-01-24
60572,82876,Fox News Poll: Clinton drops below 50 percent as her lead over Sanders shrinks,Fox News,2016-01-25
60573,82878,Fox News Poll: Sanders up by 22 points in New Hampshire,Fox News,2016-01-25
60574,82879,Fox News Poll: Sanders narrows gap in Iowa,Fox News,2016-01-25
60575,82880,7 days to win hearts and minds: Candidates race to Iowa kick-off,Fox News,2016-01-25
60576,82881,Former Texas governor Rick Perry endorses Ted Cruz,Fox News,2016-01-25
60577,82882,Grand jury in Texas indicts activists behind Planned Parenthood videos,Fox News,2016-01-25
60578,82883,Planned Parenthood files federal lawsuit over undercover videos,Fox News,2016-01-14
60579,82884,American reported killed while walking on Caribbean beach with her husband,Fox News,2016-01-25
60580,82885,News producer found dead in Belize was strangled,Fox News,2016-01-16
60581,82886,Explorer dies after dehydration forces him to end solo Antarctic trek,Fox News,2016-01-25
60582,82887,’String of miracles’: Mom hears son’s heart beat in man whose life he saved,Fox News,2016-01-25
60583,82888,Video captures moment dying teen realizes he survived,Fox News,2016-01-25
60584,82889,Banished US veterans lean on each other south of border,Fox News,2016-01-26
60585,82891,Fox News announces GOP debate candidate lineup,Fox News,2016-01-26
