Column,id,title,publication,date
62386,84930,Tesla driver using Autopilot feature killed by tractor trailer,Fox News,2016-06-30
62387,84931,Fox News Poll:  Fewer Americans feeling proud,Fox News,2016-06-30
62388,84932,"Fourth of July: In 2016, Thomas Jefferson still speaks to Americans",Fox News,2016-06-30
62389,84933,Candace Cameron Bure: ’We have ability to love God’ in America,Fox News,2016-06-30
62390,84934,"’Focus is on heroes’: After Trump fundraiser furor, vet groups keep to their mission",Fox News,2016-06-30
62391,84935,Cafe told to remove ’God Bless America’ banner ,Fox News,2016-06-30
62392,84936,Hostages taken in attack on restaurant in Bangladesh capital; witness says gunmen chanted ’Allahu Akbar’,Fox News,2016-07-01
62393,84938,Coalition forces kill two senior ISIS military commanders in Iraq,Fox News,2016-07-01
62394,84939,Clinton sought secret info on EU bailout plans as son-in-law’s doomed hedge fund gambled on Greece,Fox News,2016-07-01
62395,84940,"Lynch regrets tarmac meetup with Bill Clinton, vows to follow FBI recommendation on email probe",Fox News,2016-07-01
62396,84941,State Department seeks 27-month delay for release of Clinton Foundation emails,Fox News,2016-07-01
62397,84942,Clinton campaign raises $44 million in June,Fox News,2016-07-01
62398,84943,"US: Up to 116 civilians killed in drone, other air attacks",Fox News,2016-07-01
62399,84944,Escape from ISIS: Yazidi woman recounts life as a sex slave,Fox News,2016-07-01
62400,84945,One-armed ISIS commander eyed as mastermind of Istanbul massacre,Fox News,2016-06-30
62401,84946,"People Magazine writer blast celebs, staff in scathing resignation letter ",Fox News,2016-07-01
62402,84947,Erin Andrews fires back at haters on Twitter,Fox News,2016-06-30
62403,84948,Roseanne Barr isn’t singing Hillary Clinton’s praises  ,Fox News,2016-07-01
62404,84949,World reacts to the death of Elie Wiesel,Fox News,2016-07-02
62405,84950,Trump calls for charges against Clinton after FBI interview in email investigation,Fox News,2016-07-02
62406,84951,"Trump says he’s filled convention speaker spots; tries to reverse slide, seize on Clinton’s tough week",Fox News,2016-07-02
62407,84952,Obama to campaign with Clinton for first time in 2016,Fox News,2016-07-02
62408,84953,US accuses Russian warship of aggressive maneuvers for second time in as many weeks,Fox News,2016-07-02
62409,84954,US officials: Russia ignored ’rules of the road’ sailing dangerously close to Navy destroyer,Fox News,2016-06-29
62410,84955,"At least 5 dead, 25 injured when Florida bus, tractor trailer collide",Fox News,2016-07-02
62411,84956,"2 killed, 14 injured when van hit NJ guardrail, flipped over",Fox News,2016-07-02
62412,84957,Suicide attack carried out near US diplomatic site in Saudi Arabia,Fox News,2016-07-04
62413,84959,"More than 100 killed, scores wounded in bombings across Baghdad",Fox News,2016-07-03
62414,84960,UAE warns citizens traveling abroad to avoid wearing traditional garb after Ohio incident,Fox News,2016-07-04
62415,84961,"Iranian commander warns there are 100,000 missiles ready to strike Israel",Fox News,2016-07-04
62416,84962,Israeli airstrikes hit Hamas in Gaza after rocket strikes kindergarten,Fox News,2016-07-01
62417,84963,"Palestinian kills Israeli, wounds family in West Bank attack",Fox News,2016-07-01
62418,84964,Shooting gallery game rejected by Phoenix July 4 festival organizers,Fox News,2016-07-04
62419,84965,"Man shot dead after attempting to drive through Nevada chicken wing festival, police say",Fox News,2016-07-03
62420,84966,"9-year-old girl loses hand, fingers after fireworks accident in California",Fox News,2016-07-04
62421,84967,Fourth of July 2016: What the Founders ask of us,Fox News,2016-07-04
62422,84968,Photo historian: What I see when I look at America,Fox News,2016-07-03
62423,84970,"Police investigating death of Wisconsin student in Rome as murder, family says",Fox News,2016-07-04
62424,84972,"Florida cops say disappearance of woman, 84, now a homicide probe",Fox News,2016-07-01
62425,84973,Florida teen shot by father at gun range described as one of the safest ever,Fox News,2016-07-04
62426,84974,June gun sales crush previous record,Fox News,2016-07-04
62427,84975,Off-duty NYC cop fatally shoots man after traffic dispute,Fox News,2016-07-04
62428,84977,Republican delegate revolt grows in effort to sidetrack Trump nomination,Fox News,2016-07-04
62429,84978,VP vetting? Trump meets with Sen. Joni Ernst,Fox News,2016-07-04
62430,84979,"Trump’s tweet of Clinton, Star of David, pile of cash originated from hate group website",Fox News,2016-07-04
62431,84980,Obama to tell foe-to-friend story at Hillary Clinton event,Fox News,2016-07-04
62432,84981,At least 4 killed in suicide blast near one of Islam’s holiest sites in Medina,Fox News,2016-07-04
62433,84983,Security tightened in Baghdad as death toll from bombing climbs to 157,Fox News,2016-07-04
62434,84984,"Tens of thousands of Syrians trapped in ISIS fight, many starving, UN warns",Fox News,2016-07-04
62435,84989,Ryan formally urges Clapper to block Clinton from classified briefings,Fox News,2016-07-07
62436,84990,"Clinton email investigation to be closed with no criminal charges, Lynch announces",Fox News,2016-07-06
62437,84991,Trump: Clinton attacking his biz record to avoid ’lies she told to the FBI’,Fox News,2016-07-06
62438,84992,"Thousands of State Department e-mail accounts still risk being hacked, report says",Fox News,2016-07-07
62439,84993,Russia sends its only aircraft carrier to Syria in response to US,Fox News,2016-07-07
62440,84994,Former army chief warns Australia not to ’blindly’ follow US,Fox News,2016-07-06
62441,84995,Louisiana police shooting caught on video strains community,Fox News,2016-07-07
62442,84996,New video emerges showing police shooting of unarmed Fresno man,Fox News,2016-07-07
62443,84997,Two charged after video shows man jumping on swimming moose,Fox News,2016-07-07
62444,84998,61-year-old says he punched aggressive bear in the face and survived,Fox News,2016-07-07
62445,84999,State Department reopens internal probe of Clinton emails,Fox News,2016-07-07
62446,85001,Comey testifies Clinton email claims ‘not true’ at heated Hill hearing,Fox News,2016-07-07
62447,85002,Krauthammer: Comey failed to indict because he didn’t want to ’change the course of American political history’,Fox News,2016-07-07
62448,85003,FBI chief’s testimony about Clinton emails torpedoes the bureau’s reputation ,Fox News,2016-07-07
62449,85004,"When it comes to Hillary Clinton, American justice is blind, deaf and dumb",Fox News,2016-07-07
62450,85006,"Photo of Obama in Muslim garb shows deep ties to faith, O’Reilly says",Fox News,2016-07-07
62451,85007,Mysterious noises plaguing Southern California town baffles residents,Fox News,2016-07-07
62452,85008,Terrorist who slaughtered American hiker lauded on Palestinian TV,Fox News,2016-07-07
62453,85009,"Racial rage drove sniper’s deadly rampage, home held arsenal of weapons",Fox News,2016-07-08
62454,85011,"Dallas sniper who gunned down 5 cops ’wanted to kill white people,’ chief says",Fox News,2016-07-08
62455,85012,Dallas police used bomb robot to kill shooting suspect,Fox News,2016-07-08
62456,85013,Hero mom shot while shielding son from bullets in Dallas attack,Fox News,2016-07-08
62457,85014,Dallas police murders spark social media frenzy,Fox News,2016-07-08
62458,85015,Celebrities react to Dallas police shooting,Fox News,2016-07-08
62459,85016,Facebook activates Safety Check service after sniper attack on Dallas police,Fox News,2016-07-08
62460,85017,"Murdered Dallas cops were veterans, husbands and fathers who died protecting protesters’ rights",Fox News,2016-07-08
62461,85018,Police officers across nation patrolling in pairs after Dallas ambush,Fox News,2016-07-08
62462,85019,The war on cops: The big lie of the anti-cop left turns lethal,Fox News,2016-07-08
62463,85020,"Dallas, Minnesota and Baton Rouge: If this is a war, then there will be no winners",Fox News,2016-07-08
62464,85021,Obama renews gun control push after ’senseless’ Dallas murders,Fox News,2016-07-08
62465,85022,Dallas attack: The ’Pigs in a Blanket’ crowd got what they wanted,Fox News,2016-07-08
62466,85023,"Cleveland police union concerned about safety at RNC, anti-cop rhetoric",Fox News,2016-07-08
62467,85024,"Trump, Clinton respond to Dallas shooting with restraint, calls for unity",Fox News,2016-07-08
62468,85025,Rep. Corrine Brown indicted in fraud case over charity ’slush fund’,Fox News,2016-07-08
62469,85026,Top police group wants Justice to investigate Dallas police killings as hate crime,Fox News,2016-07-10
62470,85028,"Dallas sniper reportedly planned larger attack, changed plans to target protest",Fox News,2016-07-09
62471,85029,"Obama urges Americans to be positive about race relations, saying ’We’ve got a foundation’ ",Fox News,2016-07-09
62472,85030,Report: Dallas sniper seen conducting military training exercises leading up to attack,Fox News,2016-07-09
62473,85031,Growing memorial at Dallas Police Headquarters is spot for flowers and tears,Fox News,2016-07-09
62474,85033,"Officer who shot Minnesota man reacted to gun, not race, lawyer says",Fox News,2016-07-10
62475,85034,At least 5 police officers injured during protests in Minnesota,Fox News,2016-07-10
62476,85035,Black Lives Matter activist DeRay McKesson arrested in Louisiana protest,Fox News,2016-07-10
62477,85036,Dallas police placed on high alert after anonymous threat following attack,Fox News,2016-07-09
62478,85037,"Alabama sheriff’s deputy wounded, suspect dead after hostage situation",Fox News,2016-07-09
62479,85038,"Suspect’s friends, family shocked by Tennessee shooting",Fox News,2016-07-09
62480,85039,"Mass shootings send ripples through Capitol Hill chambers, tunnels",Fox News,2016-07-09
62481,85040,’Hamilton’ creator Lin-Manuel Miranda takes final bow,Fox News,2016-07-10
62482,85041,Police may change tactics at protests after Dallas shooting,Fox News,2016-07-11
62483,85043,Dallas disaster: Are the media’s angry voices finally being drowned out?,Fox News,2016-07-11
62484,85044,Dallas shooter scrawled letters in blood at parking garage,Fox News,2016-07-10
62485,85045,Texas mom shot while protecting sons thanks police,Fox News,2016-07-10
62486,85047,"No evidence Dallas cop killer connected to terror network, Homeland Secretary Johnson says",Fox News,2016-07-10
62487,85048,Gov or VP? Indiana’s Pence has Friday ballot deadline,Fox News,2016-07-11
62488,85049,Texas governor burned in accident; could miss GOP convention,Fox News,2016-07-11
62489,85050,"Trump adviser, possible veep choice Flynn says abortion is a woman’s choice ",Fox News,2016-07-10
62490,85051,Ex-Army lieutenant colonel charged with collecting pay while in prison,Fox News,2016-07-11
62491,85052,Navy revises ’American Sniper’ Chris Kyle’s medal count,Fox News,2016-07-11
62492,85055,Dallas’ top cop has answer for protesters: Join us,Fox News,2016-07-11
62493,85057,"Hey, Black Lives Matter, stop terrorizing our cities",Fox News,2016-07-11
62494,85058,"Greg Gutfeld: Dallas attacks killed five, injured 318 million",Fox News,2016-07-11
62495,85059,Black militia co-founder: Dallas shooter ’shall be celebrated’,Fox News,2016-07-11
62496,85060,"Trade, delegates emerge as potential flashpoints as GOP preps for convention",Fox News,2016-07-11
62497,85061,"Trump declares himself ’law and order candidate,’ calls for anti-police ’hostility’ to end",Fox News,2016-07-11
62498,85063,Soda maker’s campaign drinks: Trump Tonic and Hillary Hooch,Fox News,2016-07-11
62499,85064,Anti-Trump delegate in Virginia wins portion of lawsuit,Fox News,2016-07-11
62500,85065,Terrifying image of cop being killed goes viral after Dallas attack,Fox News,2016-07-11
62501,85066,Officials concerned about ’virtual’ war on cops,Fox News,2016-07-11
62502,85067,Art gallery stands by anti-police violence flag in wake of deadly Dallas shooting,Fox News,2016-07-11
62503,85068,House Republicans want more answers from FBI’s Comey on Clinton case,Fox News,2016-07-11
62504,85069,"House conservatives may ignore Ryan, attempt to impeach IRS commissioner",Fox News,2016-07-12
62505,85071,"Stolen guns would have targeted officers in Baton Rouge, investigators say",Fox News,2016-07-12
62506,85072,Deputies reportedly taunted at Zaxby’s restaurant in North Carolina,Fox News,2016-07-12
62507,85073,Former Miss Alabama calls Dallas cop shooter a ’martyr’,Fox News,2016-07-12
62508,85074,Four cops reportedly walk out of WNBA game after players wear ’Black Lives Matter’ shirts,Fox News,2016-07-12
62509,85075,"Trump calls Black Lives Matter ’divisive’, criticizes police shootings",Fox News,2016-07-12
62510,85076,Obama’s toxic mind game with police,Fox News,2016-07-12
62511,85077,FBI no longer actively investigating D.B. Cooper case,Fox News,2016-07-12
62512,85078,Standup comic-turned-Ohio small-town mayor indicted on theft charges,Fox News,2016-07-12
62513,85079,Sketch released of suspect who allegedly held NY woman against her will,Fox News,2016-07-12
62514,85080,"Fugitive polygamous sect leader likely used olive oil to aid escape, FBI says",Fox News,2016-07-12
62515,85081,Sanders supporters lash out following Clinton endorsement,Fox News,2016-07-13
62516,85083,"Trump suggests now just two veep finalists, questions Ginsberg’s ’mental capacity’",Fox News,2016-07-13
62517,85084,Ginsburg under fire from both sides over ‘highly inappropriate’ Trump comments,Fox News,2016-07-13
62518,85085,How can Supreme Court justices be penalized? There’s really only one option,Fox News,2016-07-13
62519,85086,Sanders supporters reportedly to hold Philly ’fart-in’,Fox News,2016-07-13
62520,85087,Cleveland officials say they’re ready for GOP convention security — but plans have changed,Fox News,2016-07-13
62521,85088,’God’s Not Dead 2’ billboard reportedly banned at RNC,Fox News,2016-07-13
62522,85089,Sanders finally endorses Hillary. But there are still lots of problems ahead ,Fox News,2016-07-12
62523,85090,Cleveland catastrophe? Media forecast a disastrous Trump convention,Fox News,2016-07-13
62524,85091,"Ryan defends Trump backing, says no ’third option’",Fox News,2016-07-13
62525,85092,Fox News Poll: Clinton tops Trump by 7 points in Virginia,Fox News,2016-07-13
62526,85093,Fox News Poll: Trump trails Clinton in Colorado,Fox News,2016-07-13
62527,85094,"Poll: Trump leads Clinton in Florida; too close to call in Ohio, Pennsylvania",Fox News,2016-07-13
62528,85095,Trump seeks $10 million from former aide in disclosure case,Fox News,2016-07-13
62529,85096,Confessions of a captured ISIS fighter ,Fox News,2016-07-13
62530,85097,Islamic State reportedly preparing for end of its so-called caliphate,Fox News,2016-07-13
62531,85098,"Pakistan school attack mastermind killed by US airstrike, Pentagon says",Fox News,2016-07-13
62532,85099,Ex-Gitmo detainee connected to Turkey airport attack added to US list of terrorists,Fox News,2016-07-13
62533,85100,"ISIS claims 5,200 victims in Ramadan campaign of terror",Fox News,2016-07-13
62534,85101,Transgender woman arrested in voyeurism incident at Idaho Target,Fox News,2016-07-13
62535,85102,Civil War-era shipwreck found off North Carolina coast,Fox News,2016-03-08
62536,85103,Live Blog: Nice terror attack ,Fox News,2016-07-14
62537,85104,Can GOP hold the Senate? Polls give party edge in key states,Fox News,2016-07-14
62538,85105,"Congress leaves Washington without action on Zika, budgets",Fox News,2016-07-14
62539,85106,"From guns to impeachment, lawmakers planting their political seeds",Fox News,2016-07-14
62540,85107,Trump says he is delaying VP announcement due to truck attack in France,Fox News,2016-07-14
62541,85108,Ginsburg says she regrets comments on Trump,Fox News,2016-07-14
62542,85109,Memo to Justice Ruth Bader Ginsburg: Silence is golden,Fox News,2016-07-13
62543,85110,"Trump closing the gap with Clinton after FBI email decision, polls show",Fox News,2016-07-14
62544,85111,"Trump campaign poised to derail efforts to ’unbind’ all 2,472 delegates",Fox News,2016-07-14
62545,85112,Gov. Mike Pence bio,Fox News,2016-07-14
62546,85113,Death by Pokemon? Public safety fears mount as ’Pokemon Go’ craze continues,Fox News,2016-07-14
62547,85114,Pokemon Go: Social justice warriors want you to feel bad about having fun ,Fox News,2016-07-14
62548,85115,FarmVille creator: ’Pokemon GO’ just a fad? ,Fox News,2016-07-14
62549,85116,Sex offender nabbed playing ’Pokemon Go’ with kid,Fox News,2016-07-14
62550,85117,"Coup underway in Turkey amid reports of gunfire, explosions in major cities, police deaths",Fox News,2016-07-15
62551,85119,Trump campaign running on a shoestring – still,Fox News,2016-07-15
62552,85120,"Dem knives come out for Pence pick, moments after Trump tweet",Fox News,2016-07-15
62553,85121,Trump names Pence as running mate,Fox News,2016-07-15
62554,85122,Why Mike Pence is a gutsy choice for Trump,Fox News,2016-07-15
62555,85123,Sen. Warren meets with Clinton amid VP speculation,Fox News,2016-07-15
62556,85124,"Fox News Channel, FoxNews.com to present live coverage throughout GOP National Convention",Fox News,2016-07-15
62557,85125,"Terror fiend tricked police to get death truck onto busy Nice promenade, kill 84",Fox News,2016-07-15
62558,85126,"Terrorist behind Nice attack a creepy loner; not overtly religious, say neighbors",Fox News,2016-07-15
62559,85127,Obama pledges U.S. support following France terror attack,Fox News,2016-07-15
62560,85128,Father and son killed in Nice terror attack mourned by Texas community,Fox News,2016-07-15
62561,85129,France terror attack stokes refugee debate on campaign trail,Fox News,2016-07-15
62562,85130,"Terror in Nice, France: This is war. It’s aimed at the West. And we must fight back",Fox News,2016-07-15
62563,85131,"At least 161 killed, scores wounded as Turkish military attempts coup",Fox News,2016-07-16
62564,85132,Turkey’s last hope dies,Fox News,2016-07-16
62565,85133,Fox News Reporting -- Takeover -- The Trump Convention,Fox News,2016-07-16
62566,85134,"At first official event, Pence, Trump set sights on Clinton, vow to restore prosperity, safety to America",Fox News,2016-07-16
62567,85135,"After Pence becomes running mate, Trump changes campaign logo -- again",Fox News,2016-07-16
62568,85137,"Police officers pay for motel room, help raise $150G for homeless teen who biked six hours to college",Fox News,2016-07-16
62569,85138,Pennsylvania burglary suspect admits using stolen brain to get high,Fox News,2016-07-16
62570,85139,Black and a cop: Detective says ’We’ve all got work to do’,Fox News,2016-07-17
62571,85140,Obama urges Americans to tamp down inflammatory rhetoric,Fox News,2016-07-17
62572,85141,Baton Rouge murders: If killing cops becomes the new normal America is doomed,Fox News,2016-07-17
62573,85142,Baltimore police arrest more than 20 people during protest,Fox News,2016-07-17
62574,85143,Funeral held for last of five murdered Dallas police officers,Fox News,2016-07-16
62575,85144,Kasich says hands tied as Cleveland police union seeks open-carry ban for convention,Fox News,2016-07-17
62576,85145,"Trump ready to define the true ‘change’ needed in convention speech, Manafort says",Fox News,2016-07-17
62577,85146,"Trump family, a few celebs and former rivals round out GOP convention speaker list",Fox News,2016-07-17
62578,85147,Cleveland beefs up security measures in wake of Nice terror attack,Fox News,2016-07-17
62579,85148,Priebus on Republican convention: ’We’re ready for it’,Fox News,2016-07-17
62580,85149,Republican National Convention: By the numbers,Fox News,2016-07-17
62581,85151,"Suspect charged in shooting deaths of patient, employee at Florida hospital",Fox News,2016-07-17
62582,85152,Pakistani model’s brother says he killed her for ’honor’,Fox News,2016-07-17
62583,85153,"Sheriff: 3 dead, 1 wounded in Washington state shootings",Fox News,2016-07-17
62584,85154,14 people shot outside party in Southern California,Fox News,2016-07-16
62585,85155,UC Berkeley student confirmed dead in Nice terror attack,Fox News,2016-07-17
62586,85156,Driver in Nice truck attack researched route ahead of massacre,Fox News,2016-07-17
62587,85157,"2 new arrests in Nice truck attack, as ISIS claim studied",Fox News,2016-07-17
62588,85158,Fox News hosts Digital Hangout during conventions,Fox News,2016-07-18
62589,85159,"Republican officials approve convention rules, triggering uproar",Fox News,2016-07-18
62590,85160,Rocky opening for GOP convention as Cruz forces clash with team Trump,Fox News,2016-07-18
62591,85161,"Cleveland says protesters can carry guns, but not tennis balls",Fox News,2016-07-18
62592,85162,Trump campaign calls Kasich convention absence ’embarrassing’,Fox News,2016-07-18
62593,85163,"Trump, GOP say convention ’unity’ key in effort to defeat Clinton",Fox News,2016-07-18
62594,85164,Media greet Donald Trump in Cleveland with a Bronx cheer,Fox News,2016-07-18
62595,85165,Clinton tries to grab Ohio spotlight with NAACP speech,Fox News,2016-07-18
62596,85166,The Cleveland Show: Convention starts under security cloud,Fox News,2016-07-18
62597,85168,"Lawsuit seeks to expose, unravel plea deal for billionaire sex offender",Fox News,2016-07-18
62598,85169,Billionaire sex offender Epstein once claimed he co-founded Clinton Foundation,Fox News,2016-07-06
62599,85170,Hacker Guccifer 2.0 claims new DNC data leak,Fox News,2016-07-18
62600,85172,At least 15 people reportedly injured in axe attack on train in Germany,Fox News,2016-07-18
62601,85173,"Nice, France attacker reportedly recruited by Algerian ISIS fighter, researched Orlando massacre",Fox News,2016-07-18
62602,85174,Losing the children to acts of terror,Fox News,2016-07-17
62603,85176,"Trump closes the deal, becomes Republican nominee for president",Fox News,2016-07-19
62604,85177,Utah delegate says she was threatened in bathroom after anti-Trump push,Fox News,2016-07-19
62605,85178,Who in their right mind would plagiarize a Democrat’s speech?,Fox News,2016-07-19
62606,85179,Four things we’ve learned (so far) from the Republican Convention,Fox News,2016-07-19
62607,85180,Judith Miller: How Mike Pence worked to protect freedom of the press,Fox News,2016-07-19
62608,85181,Police break up skirmishes among demonstrators in Cleveland,Fox News,2016-07-19
62609,85183,"Ailes denies new harassment report, remains on the job",Fox News,2016-07-19
62610,85184,Crossfit Games to award Glock pistols to winning athletes,Fox News,2016-07-19
62611,85185,"Dad, teen son ordered to disclose data on gun-firing, flame-throwing drones",Fox News,2016-07-19
62612,85186,What Matt Damon doesn’t get about the US and guns,Fox News,2016-07-19
62613,85187,"Illinois gun restrictions unfairly target foster parents, lawsuit claims",Fox News,2016-07-15
62614,85188,Kansas police officer shot and killed responding to shooting report,Fox News,2016-07-19
62615,85189,Rep. King takes heat for questioning contribution of non-whites in society,Fox News,2016-07-19
62616,85190,Black Lives Matter activists arrested after protest stops traffic in Virginia,Fox News,2016-07-19
62617,85191,"Police come under gunfire at gun shop in Marietta, Georgia",Fox News,2016-07-19
62618,85192,Obama says some police departments need more resources to train officers,Fox News,2016-07-19
62619,85193,"Clinton zeroes in on ’safe’ VP picks, as problems surface with others",Fox News,2016-07-20
62620,85194,Trump could face headwinds in Ohio – but GOP insiders push for unity,Fox News,2016-07-20
62621,85195,Melania Trump speechwriter admits ’mistake’ in lifting Michelle Obama lines,Fox News,2016-07-20
62622,85196,Regulator sniffs scented oxygen on taxpayer-funded RNC trip,Fox News,2016-07-20
62623,85197,Sanders to meet with delegates before start of Democratic convention,Fox News,2016-07-20
62624,85198,"Kennedy:  The good, the bad and the smelly -- My adventures with Cleveland’s protesters",Fox News,2016-07-20
62625,85200,"Protesters arrested at flag-burning outside GOP convention, officers injured",Fox News,2016-07-20
62626,85201,"’Capitalism at work’: Unique Trump gear, drinks selling well at GOP convention",Fox News,2016-07-20
62627,85202,Urban Outfitters playing (anti-Trump) politics with merchandise?,Fox News,2016-07-20
62628,85203,Federal appeals court orders changes to Texas voter ID law,Fox News,2016-07-20
62629,85204,"Wisconsin residents without ID can vote in November, judge rules",Fox News,2016-07-19
62630,85205,Iraq’s ’Black Devils’ strike fear in the ISIS terrorists they hunt,Fox News,2016-07-20
62631,85206,US intel bulletin warns of persistent threat from ’Western female violent extremists’,Fox News,2016-07-20
62632,85207,"The murky role of mental illness in extremism, terror",Fox News,2016-07-20
62633,85208,US Air Force lieutenant found dead in room in UAE,Fox News,2016-07-20
62634,85209,"Arizona man charged with plotting terror attack also eyed Jewish center, FBI says",Fox News,2016-07-20
62635,85210,"Clinton VP plot thickens, as Trump prepares to accept GOP nod",Fox News,2016-07-21
62636,85211,Trump takes heat from NATO officials for interview comments,Fox News,2016-07-21
62637,85212,"Dems knock GOP convention for attacks, can’t promise Philadelphia will be different",Fox News,2016-07-21
62638,85213,"Trump calls Cruz non-endorsement ’no big deal,’ senator defends decision",Fox News,2016-07-21
62639,85214,Cruz faces political fallout for Trump non-endorsement – will it last?,Fox News,2016-07-21
62640,85215,Party disunity? Cruz’s ’me’ moment is the latest distraction at Trump’s convention,Fox News,2016-07-21
62641,85216,"Trump may be crass, but Cruz broke his word",Fox News,2016-07-21
62642,85217,"Pence rallies GOP to unite, accepts VP nod; Cruz withholds endorsement",Fox News,2016-07-21
