Column,id,title,publication,date
63414,86086,Fox News Electoral Scorecard: 2016 race tightens in key battlegrounds,Fox News,2016-09-20
63415,86087,CNN claims Trump called for ’racial’ profiling (he didn’t),Fox News,2016-09-20
63416,86088,Trump Jr. draws outrage after likening Syrian refugees to poisoned Skittles,Fox News,2016-09-20
63417,86089,Judge: District does not have to rehire praying coach,Fox News,2016-09-20
63418,86090,"Fox News Poll: Trump tops Clinton in battlegrounds Nevada, N. Carolina, Ohio",Fox News,2016-09-21
63419,86092,Trump praises ’stop-and-frisk’ police tactic at African-American town hall,Fox News,2016-09-21
63420,86093,ISIS believed to have attacked US base in Iraq with chemical agent,Fox News,2016-09-21
63421,86094,Exclusive photos appear to show grisly effect of ISIS’ mustard gas attacks on Kurds,Fox News,2015-09-09
63422,86095,Pentagon denies Moscow’s claim that US may have bombed aid convoy in Syria,Fox News,2016-09-21
63423,86096,"US, Russia trade barbs over Syria at UN Security Council",Fox News,2016-09-21
63424,86097,New low: Disgraced Dem Anthony Weiner sorry after texts to 15-year-old revealed,Fox News,2016-09-21
63425,86098,Gregg Jarrett: Is Anthony Weiner sexting his way to the slammer?,Fox News,2016-09-21
63426,86099,How will Brad Pitt and Angelina Jolie divide their $400 million fortune?,Fox News,2016-09-21
63427,86100,Brangelina’s marriage is corked: Who gets Miraval winery?,Fox News,2016-09-21
63428,86101,Splitsville for Jolie and Pitt: A marriage can fall apart when parents clash over parenting,Fox News,2016-09-21
63429,86102,Email shows federal immigration bosses in OT push to swear in new citizens ’due to election’,Fox News,2016-09-22
63430,86104,"Trump supports ’stop and frisk,’ calls for unity in wake of Charlotte riots",Fox News,2016-09-22
63431,86105,Yahoo confirms 500 million accounts compromised in huge data breach,Fox News,2016-09-22
63432,86106,Tulsa officer charged with manslaughter in shooting of African-American man,Fox News,2016-09-22
63433,86107,Disturbing videos show violence during Charlotte protests,Fox News,2016-09-22
63434,86108,"America, the rioting in Charlotte is Saul Alinsky 101",Fox News,2016-09-22
63435,86109,"FBI handling Brad Pitt child abuse allegations, sources and LAPD say",Fox News,2016-09-22
63436,86110,What the Brangelina split tells us: A wife (even Mrs. Pitt) wants to be cherished,Fox News,2016-09-22
63437,86111,Marion Cotillard denies Brad Pitt affair rumors,Fox News,2016-09-22
63438,86112,Trump’s debate strategy: Let Clinton talk,Fox News,2016-09-23
63439,86114,FBI releases nearly 200 pages of Clinton email probe documents,Fox News,2016-09-23
63440,86115,Cruz says he will vote for Trump,Fox News,2016-09-23
63441,86116,Five questions to consider before Trump meets Hillary at Hofstra,Fox News,2016-09-23
63442,86117,"FBI gave top Clinton aide Cheryl Mills immunity in email probe, rep says",Fox News,2016-09-23
63443,86118,"Jailhouse Letter: Guccifer laments failure to expose ’crimes,’ rails against Clinton",Fox News,2016-09-23
63444,86119,Man survives knife in eye socket,Fox News,2016-09-23
63445,86120,Southern California child tests positive for leprosy,Fox News,2016-09-23
63446,86121,"Video of deadly encounter between Charlotte police, Keith Lamont Scott posted online",Fox News,2016-09-23
63447,86122,Franklin Graham says only God can fix Charlotte,Fox News,2016-09-23
63448,86123,Police announce arrest in shooting death at Charlotte riot,Fox News,2016-09-23
63449,86124,"Officer charged in Tulsa shooting surrenders, posts bond",Fox News,2016-09-23
63450,86125,"After Charlotte shooting, press downplays a key fact: The officer’s race",Fox News,2016-09-23
63451,86126,Emails show NBC’s Andrea Mitchell telling Colin Powell Trump’s nomination is ’awful’,Fox News,2016-09-23
63452,86127,MSNBC wins big at Media Research Center’s Dishonors Awards night,Fox News,2016-09-23
63453,86128,Heil Donald? Students instructed to compare Hitler to Trump,Fox News,2016-09-23
63454,86129,Teacher: Kids wearing Trump gear are racist,Fox News,2016-09-23
63455,86131,Suspect in Washington state mall shooting in custody,Fox News,2016-09-25
63456,86133,Three-year-old girl among 8 injured in Baltimore shooting,Fox News,2016-09-25
63457,86134,Charlotte police release video of shooting of Keith Lamont Scott,Fox News,2016-09-24
63458,86135,"As first debate nears, Clinton taps former aide Reines to play Trump",Fox News,2016-09-24
63459,86136,Obama reportedly used pseudonym to email with Clinton on her private server,Fox News,2016-09-24
63460,86137,Top Clinton aide dismissed IT specialist’s concerns about private email server,Fox News,2016-09-24
63461,86138,"Dana Perino: Debate Prep 2016 -- Selfie sticks, bitmoji pantsuits and the millennial vote",Fox News,2016-09-24
63462,86139,Clinton vs. Trump: How to fix an already predictable debate,Fox News,2016-09-24
63463,86140,Netanyahu to meet with Trump and Clinton,Fox News,2016-09-24
63464,86141,South Korean official says country has plan to assassinate Kim Jong Un,Fox News,2016-09-23
63465,86142,"Trump, Clinton meet with Netanyahu as presidential debate looms",Fox News,2016-09-26
63466,86144,"Clinton, Trump take distinct paths to debate, now a prime-time, mega event",Fox News,2016-09-25
63467,86145,"Clinton campaign defends immunity deal for aide Mills, others in FBI email probe",Fox News,2016-09-25
63468,86146,Southern California police agencies missing more than 300 weapons,Fox News,2016-09-26
63469,86148,Protesters kneel during National Anthem outside Panthers-Vikings game amid increased police presence,Fox News,2016-09-25
63470,86149,New York boy asks Obama in letter if Syrian refugee Omran Daqneesh can live with him,Fox News,2016-09-26
63471,86150,WWII veteran awarded Purple Heart 72 years after he was wounded,Fox News,2016-09-25
63472,86151,"WWII Navy chief reunited, in spirit, with his ship’s bell",Fox News,2016-09-25
63473,86152,"Ben Steele, Bataan Death March survivor, dies at 98",Fox News,2016-09-25
63474,86153,"2 men arrested, teen girl detained in connection with Southern California killings",Fox News,2016-09-26
63475,86154,"Illinois man says he, not his twin brother, committed murder",Fox News,2016-09-25
63476,86155,Man faces life in prison for murder of transgender woman,Fox News,2016-09-24
63477,86156,Cops hunt for killer after body found in Hollywood Hills home rented by ex-TV host,Fox News,2016-09-23
63478,86157,Join Fox News’ debate watch party,Fox News,2016-09-26
63479,86158,"US/Israel bond will endure whoever wins election, says Ehud Barak",Fox News,2016-09-26
63480,86159,Make America eat again: Clinton and Trump-themed foods to enjoy during the debate,Fox News,2016-09-26
63481,86160,Why is Hillary here?,Fox News,2016-09-26
63482,86161,BIAS ALERT: Amazon ’fixed’ reviews for Hillary Clinton’s book,Fox News,2016-09-26
63483,86162,433K people die every year because they sat for too long,Fox News,2016-09-26
63484,86163,Why morning sickness may be a good thing,Fox News,2016-09-26
63485,86164,Docs dig for patients’ personal info to better predict health outcomes,Fox News,2016-09-26
63486,86165,Maternal instinct leads to baby’s life-saving open heart surgery,Fox News,2016-09-26
63487,86166,Officials: 9 wounded in Houston shooting,Fox News,2016-09-26
63488,86167,"FBI: Violent crime across US spiked in 2015, murders up nearly 11 percent",Fox News,2016-09-26
63489,86168,Mall shooting suspect had blog with picture of ISIS leader,Fox News,2016-09-26
63490,86169,Tech company creates facial image to help ID UNC student’s killer,Fox News,2016-09-26
63491,86170,Student injured in Michigan school bus shooting,Fox News,2016-09-26
63492,86171,Grand Ole Opry staple Jean Shepard dies,Fox News,2016-09-26
63493,86172,Comey: Cheryl Mills’ laptop contained ’some’ classified information,Fox News,2016-09-28
63494,86174,FBI doc dump on email case reveals role of ’confidential’ Clinton aide,Fox News,2016-09-28
63495,86175,"Clinton, Trump trade taunts after testy debate",Fox News,2016-09-28
63496,86176,Post-debate Trump fights media narrative as he tries digging out of a hole,Fox News,2016-09-28
63497,86177,How to Use FoxNews.com’s Election Prediction Map,Fox News,2016-09-26
63498,86178,Senate votes to override Obama veto on 9/11 bill,Fox News,2016-09-28
63499,86179,"Rare, but hardly unprecedented: History of veto overrides",Fox News,2016-09-28
63500,86180,"Obama vetoes 9/11 bill, setting up showdown with Congress",Fox News,2016-09-23
63501,86181,Kentucky man accused in triple homicide threatens judge,Fox News,2016-09-27
63502,86182,Miss Universe Alicia Machado accused of threatening to kill judge in late ’90s,Fox News,2016-09-28
63503,86183,"’Killer clown’ sightings spread to Florida, Virginia, Colorado",Fox News,2016-09-28
63504,86184,Vermont man lost at sea was suspect in grandfather’s killing,Fox News,2016-09-28
63505,86185,"Colorado mother arrested after disabled son, 27, dies of malnourishment",Fox News,2016-09-28
63506,86188,Clinton brings back Sanders to help with millennium slide,Fox News,2016-09-28
63507,86189,Rudolph Giuliani: Trump is right about ’stop and frisk.’ Lester Holt should apologize,Fox News,2016-09-28
63508,86190,Alec Baldwin to play Donald Trump on ’SNL’,Fox News,2016-09-28
63509,86192,Christian school goes to court to defend a 30-second pregame prayer,Fox News,2016-09-28
63510,86193,The best story of the day that the mainstream media will ignore,Fox News,2016-09-28
63511,86194,Dem lawmaker wears Hillary pin during House hearing on Clinton email probe,Fox News,2016-09-28
63512,86196,House to punt on contempt of Congress measure for Clinton IT aide,Fox News,2016-09-28
63513,86198,"South Carolina school shooting suspect killed father before attack, officials say",Fox News,2016-09-28
63514,86199,AGs file suit in last-ditch bid to stop hand-off of internet control,Fox News,2016-09-29
63515,86201,"Marco Rubio: It’s essential that we keep the internet secure, free and open",Fox News,2016-09-16
63516,86202,"Tech industry supports internet oversight change, but others are concerned",Fox News,2016-09-29
63517,86203,Supreme Court cautious on new cases as term begins under cloud of vacancy politics,Fox News,2016-09-29
63518,86204,"The Docket: Supreme Court to tackle religious freedom, election rules in new term",Fox News,2016-09-29
63519,86205,"Hey, how about a ""Pantsuit Tee""? Hillary offers clothing for the emasculated man",Fox News,2016-09-29
63520,86206,"GOP launches aggressive online push to sign up, turn out voters",Fox News,2016-09-29
63521,86207,"Army ’mistakenly’ tweets anti-Trump article, apologizes",Fox News,2016-09-29
63522,86208,Heckler sinks $100 putt during Ryder Cup practice,Fox News,2016-09-29
63523,86209,Lee Westwood enters Ryder Cup on verge of history,Fox News,2016-09-29
63524,86210,"Fox News Poll:  Clinton ahead of Trump after debate, fear motivating both sides",Fox News,2016-09-30
63525,86212,Mic Dropped: Debate commission admits ’issues’ with Trump’s audio,Fox News,2016-09-30
63526,86213,Karl Rove: Why the next week is critical for both Hillary and Trump,Fox News,2016-09-29
63527,86214,Trump: Presidential campaign could be good for his hotels,Fox News,2016-09-30
63528,86216,It’s Alive: FBI files reveal how Clinton server was created in K Street lab,Fox News,2016-09-30
63529,86217,"Key Hillary Clinton aide repeatedly misplaced sensitive info, according to reports",Fox News,2016-09-30
63530,86218,"Trump camp returns fire, targets Clintons’ treatment of women ",Fox News,2016-09-30
63531,86219,Trump weighs attack on Bill Clinton’s sexual misconduct; how would the media react?,Fox News,2016-09-29
63532,86220,Family bakery closes after left-wing bullies finally get their pound of cake ,Fox News,2016-09-30
63533,86221,CNN hypocrisy? Flashback to when network fat shamed Miss Universe Alicia Machado,Fox News,2016-09-29
63534,86222,"Ex-Miss Universe Machado disses Melania, had racy TV encounter while engaged",Fox News,2016-09-29
63535,86223,Report claims Trump declared $916M loss on 1995 income tax returns,Fox News,2016-10-02
63536,86225,"Dems stop spending to oust Rubio in Florida, as path to Senate takeover gets rockier",Fox News,2016-10-01
63537,86227,"Sen. Rubio, Rep. Heck help victims in fatal W. Virginia car crash",Fox News,2016-10-01
63538,86228,"In tape, Clinton characterized much needed young Sanders supporters, calls self ’center left, to the center right’",Fox News,2016-10-01
63539,86229,Trump looks to get past tweet frenzy with stop in swing state Pennsylvania,Fox News,2016-10-01
63540,86230,"Boy, 6, dies days after South Carolina school shooting",Fox News,2016-10-01
63541,86231,"Accused SC school shooter was expelled for bringing hatchet to class, report says",Fox News,2016-09-29
63542,86232,Volunteer firefighter credited with stopping South Carolina school shooter,Fox News,2016-09-29
63543,86233,Report: NJ high school suspends student over anti-gun control class project,Fox News,2016-10-01
63544,86234,Students wear ’White Power’ shirts to homecoming activity,Fox News,2016-09-30
63545,86235,"Gender-neutral homecoming ’queen,’ female ’king’",Fox News,2016-09-28
63546,86236,"Will weekend of ’bombshell’ stories on Clinton, Trump be prelude to bruising close to White House race?",Fox News,2016-10-02
63547,86238,Sanders admits being bothered by Clinton’s depiction of young voters who backed him,Fox News,2016-10-02
63548,86239,While HRC knocks Bernie kids as ’basement dwellers’ -- Chelsea lives in $10M apartment,Fox News,2016-10-02
63549,86240,Rep. Kristi Noem: My father’s tragic death and Hillary Clinton’s plan to tax the 1 percent,Fox News,2016-10-02
63550,86242,Report: WikiLeaks cancels highly anticipated Tuesday announcement due to ’security concerns’,Fox News,2016-10-02
63551,86243,"Christie defends Trump’s leaked tax return, says nothing illegal, ’no apologies’",Fox News,2016-10-02
63552,86244,"Trump responds to leaked IRS return, says he is best suited to fix country’s ’complex tax laws’ ",Fox News,2016-10-02
63553,86245,Sept. 11 widow sues Saudi Arabia days after Congressional override,Fox News,2016-10-02
63554,86246,Sept. 11 families can now sue the Saudis but will it matter?,Fox News,2016-09-30
63555,86247,’Making a Murderer’ subject breaks off brief engagement,Fox News,2016-10-02
63556,86248,’Making A Murder’s’ Steven Avery gets engaged,Fox News,2016-09-26
63557,86249,Steven Avery’s lawyer says he was framed,Fox News,2016-08-27
63558,86250,"Russia deploys advanced anti-missile system to Syria for first time, US officials say",Fox News,2016-10-04
63559,86252,US cuts off Syria talks with Russia as Putin backs out of nuke deal,Fox News,2016-10-03
63560,86253,Suicide bomber strikes Syrian wedding,Fox News,2016-10-03
63561,86254,"Aleppo: ""The international community has turned its back on us""",Fox News,2016-10-03
63562,86255,Clinton-backed branch of foundation donor GM now caught in major scandal,Fox News,2016-10-04
63563,86256,"Trump dismisses media focus on his taxes, says he used fed law ‘brilliantly’",Fox News,2016-10-03
63564,86257,Huckabee says ’Trump’s gotta be Trump’ in final weeks of campaign,Fox News,2016-10-04
63565,86258,Boy shot at South Carolina school to have superhero funeral,Fox News,2016-10-04
63566,86259,Man in critical condition after fight during Ravens game; 2 men arrested,Fox News,2016-10-04
63567,86260,Florida State student accused in face-biting attack headed to jail,Fox News,2016-10-03
63568,86261,"Kaine, Pence trade blows over ’insult-driven campaigns’ in VP debate",Fox News,2016-10-04
63569,86263,Pence uses Bill Clinton’s ObamaCare criticism against Kaine,Fox News,2016-10-04
63570,86264,GOP declares Pence the winner before the vice presidential debate begins,Fox News,2016-10-04
63571,86265,Kaine says Trump ’loves dictators’ at vice presidential debate,Fox News,2016-10-04
63572,86266,Trump camp slams media over ’out-of-context’ frenzy on PTSD remarks,Fox News,2016-10-04
63573,86267,Trump retweets supporter who says Kaine looks like ’Batman’ villain,Fox News,2016-10-04
63574,86268,"Pence, Kaine trade attacks, talk over each other as VP debate goes off the rails",Fox News,2016-10-04
63575,86269,AP FACT CHECK: Claims in the VP debate,Fox News,2016-10-04
63576,86270,California petitions to become first state to offer ObamaCare to illegal immigrants,Fox News,2016-10-04
63577,86271,"Dems turn on ObamaCare amid premium hikes, Bill Clinton laments ‘crazy system’",Fox News,2016-10-04
63578,86272,New charge for woman who allegedly threw twins out window,Fox News,2016-10-04
63579,86273,Apparent murder-suicide at Ohio Burger King under investigation,Fox News,2016-10-04
63580,86274,Police: 5-month-old dies after couple forgot him in hot car,Fox News,2016-10-04
63581,86275,"Florida, South Carolina on high alert as Hurricane Matthew tears through Caribbean",Fox News,2016-10-05
63582,86277,Hurricane Matthew slams Bahamas as rescuers try to reach Haiti,Fox News,2016-10-05
63583,86278,Hurricane Matthew strands hundreds of Carnival cruisers in New York City,Fox News,2016-10-05
63584,86279,Waffle House won’t stop slinging waffles during Hurricane Matthew,Fox News,2016-10-05
63585,86280,Pence says ’I think Donald Trump won’ vice presidential debate,Fox News,2016-10-05
63586,86281,"Trump takes ’victory’ lap after VP debate, says Pence was ’incredible’",Fox News,2016-10-05
63587,86282,Trump often donated to state AGs who were reviewing his business,Fox News,2016-10-05
63588,86283,"Watchdog: Feds spend $1.5B a year on PR, advertising",Fox News,2016-10-06
63589,86284,"US taxpayers made millionaires out of Afghan gangsters, warlords and connected class  ",Fox News,2016-10-04
63590,86285,VA hospital spent $300K on robots it couldn’t use,Fox News,2016-10-03
63591,86286,Feds spend $$ studying if college kids eat junk food when they drink,Fox News,2016-09-29
63592,86287,"Mixed messages from government on auto recalls, vehicle auctions",Fox News,2016-10-06
63593,86288,US traffic deaths up sharply in first half of the year,Fox News,2016-10-05
63594,86289,"US probes Ford vehicles for steering, warning light problems",Fox News,2016-10-04
63595,86290,"State of emergency declared for Florida, South Carolina as Hurricane Matthew closes in",Fox News,2016-10-06
63596,86292,"Dr. Manny: After lessons in New Orleans, think of your health needs with Hurricane Matthew",Fox News,2016-10-06
63597,86293,Hurricane Matthew forces postponement of LSU-Florida football game; other sporting events in jeopardy,Fox News,2016-10-06
63598,86294,Hurricane Matthew prep checklist: Keep your family safe and healthy,Fox News,2016-10-06
63599,86295,More than 280 reported dead in Haiti as extent of Hurricane Matthew damage comes into focus,Fox News,2016-10-06
63600,86296,Hurricane Matthew could bring political storm surge to Washington,Fox News,2016-10-06
63601,86297,"Soldiers charged with stealing, selling military equipment to foreign nations",Fox News,2016-10-06
63602,86298,Dozens of Afghan troops training in US have vanished from military bases,Fox News,2016-10-06
63603,86299,Bergdahl asks appeals court to intervene over McCain comment,Fox News,2016-10-06
63604,86300,"FBI files reveal missing email ’boxes’ in Clinton case, allegations of evidence tampering",Fox News,2016-10-06
63605,86301,"ObamaCare architect on defense over rising premiums, blames Republicans",Fox News,2016-10-06
63606,86302,Clinton camp delays Weather Channel ad buy after backlash,Fox News,2016-10-06
63607,86303,Republicans blast FBI for ’astonishing’ agreement to destroy Clinton aides’ laptops,Fox News,2016-10-05
63608,86304,"Clinton sought Pentagon, State Department contracts for Chelsea’s friend",Fox News,2016-10-06
63609,86305,Christian music banned on school bus,Fox News,2016-10-06
63610,86306,Why 300K students will be bringing Bibles to school this week,Fox News,2016-10-06
63611,86307,University of Michigan’s $85M plan aims to promote diversity,Fox News,2016-10-06
63612,86308,Fox News Poll: Clinton edges Trump by two points one month ahead of election,Fox News,2016-10-07
63613,86310,Wikileaks releases emails allegedly from Clinton campaign chair,Fox News,2016-10-07
63614,86311,"Meet me in St. Louis: Debate expert offers Trump, Clinton keys to victory",Fox News,2016-10-07
63615,86312,Leaked tape captures Trump in crude rant with TV host,Fox News,2016-10-07
63616,86313,"Hurricane Matthew - a leadership test for Trump, Clinton?",Fox News,2016-10-07
63617,86314,Trailing Trump needs debate bump,Fox News,2016-10-07
63618,86315,Email shows MSNBC producer gushing over Clinton in segment pitch,Fox News,2016-10-07
63619,86316,"Pro-Trump, Milo-linked art show in doubt after threats from anti-Trump activists",Fox News,2016-10-07
63620,86317,Karl Rove: Why Trump badly needs a debate win,Fox News,2016-10-07
63621,86318,Dinesh D’Souza: ’Something is wrong in our political system’,Fox News,2016-10-07
63622,86319,"Hurricane Matthew barrels up Southeast coast, threatens dangerous flooding",Fox News,2016-10-07
63624,86321,Coastal critters evacuated ahead of Hurricane Matthew,Fox News,2016-10-07
63625,86322,Florida rejects Clinton plea to extend voter registration deadlines,Fox News,2016-10-07
63626,86323,Bigfoot sighted in Michigan?,Fox News,2016-10-07
63627,86324,Ancient teeth lead researchers to prehistoric shark discovery,Fox News,2016-10-03
63628,86325,"Two Southern California police officers killed, one wounded; manhunt on for gunman",Fox News,2016-10-09
63629,86327,Our men and women in blue now stand in a deadly political hailstorm,Fox News,2016-10-09
63630,86328,"Sergeant killing a ’calculated execution,’ LA County sheriff says",Fox News,2016-10-07
63631,86329,"After damaging tape, defiant Trump high-fives supporters, vows to ’never drop out’",Fox News,2016-10-08
63632,86330,"Mr. Trump, it’s time for some debate judo. Here’s how to bring it to St. Louis",Fox News,2016-10-08
63633,86331,"In second Clinton debate, damaging tape increases stakes for Trump ",Fox News,2016-10-08
63634,86332,"Nancy O’Dell: ’No person, should be the subject of such crass comments’",Fox News,2016-10-08
63635,86333,"After Trump tape, Clinton WikiLeaks dump here’s what’s next, America",Fox News,2016-10-08
63636,86334,NFL tries to reassure teams as TV ratings drop,Fox News,2016-10-08
63637,86335,Troy Aikman helps Texas teen score homecoming date,Fox News,2016-10-02
63638,86336,"Jon Voight defends Trump remarks, blasts Robert De Niro for ’ugly rant’",Fox News,2016-10-09
63639,86337,Trump accuses Raddatz and Cooper of being in Clinton’s corner at debate,Fox News,2016-10-09
63640,86338,Trump on Pence’s Syrian position: ’I disagree’,Fox News,2016-10-09
63641,86339,Trump vows if elected to get special prosecutor to investigate Clinton email controversy,Fox News,2016-10-09
63642,86340,Second Clinton-Trump debate headed toward night of attacks,Fox News,2016-10-09
63643,86341,"The sex, lies and videotape debate: Trump struggles early but finishes strong",Fox News,2016-10-09
63644,86342,Trump holds pre-debate press conference with Bill Clinton accusers,Fox News,2016-10-09
63645,86343,NBC suspends Billy Bush for role on Trump tape,Fox News,2016-10-09
63646,86344,"Debate dredges up Clinton’s defense of accused rapist, audio of her ‘laughing’ at case",Fox News,2016-10-10
63647,86346,WikiLeaks’ Podesta email release reveals massive Clinton ‘hits’ file on Sanders,Fox News,2016-10-10
63648,86347,Emails: Firm that hired Abedin called Chelsea Clinton a ’spoiled brat kid’,Fox News,2016-10-10
63649,86348,"Trump, Ryan clash as House speaker vows not to campaign with nominee",Fox News,2016-10-10
63650,86349,"Staying alive? Trump on offense at 2nd debate, tries to turn tables on Clinton after tape-gate",Fox News,2016-10-10
63651,86350,Melania Trump says her ’p---y-bow’ shirt at the debate was ’unintentional’,Fox News,2016-10-10
63652,86351,"In St. Louis, moderators Raddatz, Cooper interrupt, talk over and even debate Trump",Fox News,2016-10-10
63653,86352,The scary truth about what Putin really wants (and Obama’s willful ignorance),Fox News,2016-10-08
63654,86353,"Putin, Erdogan boost Russian-Turkish trade ties",Fox News,2016-10-10
63655,86354,Court hears case of woman who apparently fell off balcony trying to escape Tinder date,Fox News,2016-10-10
63656,86355,Man accused of raping teenage relative can’t be own attorney,Fox News,2016-10-10
63657,86356,13-year-old dies after 68-day fast,Fox News,2016-10-10
63658,86357,Florida girl found safe in Tennessee; kidnapping suspect in custody,Fox News,2016-10-10
63659,86358,Supreme Court Justice Ginsburg on Kaepernick’s anthem protests: ’It’s dumb and disrespectful’,Fox News,2016-10-10
63660,86359,"Republicans claim ’collusion’ after email appears to show DOJ, Clinton campaign contact",Fox News,2016-10-11
63661,86360,"WikiLeaks, Clinton campaign in Twitter war over latest leaks",Fox News,2016-10-11
63662,86361,7 biggest revelations from WikiLeaks release of Podesta emails,Fox News,2016-10-11
63663,86362,"Gore re-emerges to stump for Clinton, warn of ‘climate crisis’",Fox News,2016-10-11
63664,86363,"Trump rips Ryan, ’disloyal’ Republicans for shunning his campaign",Fox News,2016-10-11
63665,86364,"Marine fights for Afghan interpreter, a father of 6, to gain entry into US",Fox News,2016-10-10
63666,86365,Attack on Shiite shrine in Kabul kills at least 14,Fox News,2016-10-11
63667,86366,Eight killed in Afghanistan army helicopter crash,Fox News,2016-10-09
63668,86367,Police say 2009 YouTube video has ’no connection’ to disappearance of Kayla Berg,Fox News,2016-10-12
63669,86368,Missing Florida girl recovered in Tennessee,Fox News,2016-10-10
