Column,id,title,publication,date
61367,83769,Bible charity vows to continue translation work after murders of four employees,Fox News,2016-03-30
61368,83770,"’I did not check their religion’: Priest earns praise, threats for saving thousands from violence in Africa",Fox News,2016-03-27
61369,83771,Ex-law student’s alleged illegal maneuver could land him in prison,Fox News,2016-03-30
61370,83772,Florida Gov. Rick Scott tries to court Yale University,Fox News,2016-03-30
61371,83773,"Trump meets with RNC chief in DC, days after backing out of pledge",Fox News,2016-03-31
61372,83775,Fox Business Network Poll:  Sanders tops Clinton by five in Wisconsin,Fox News,2016-03-31
61373,83776,"A message to Trump, Cruz and their followers",Fox News,2016-03-31
61374,83777,Trump is losing in Wisconsin. But why?,Fox News,2016-03-31
61375,83778,Trump gets super PAC help in Wisconsin ahead of primary,Fox News,2016-03-31
61376,83779,Cops find man accused of pepper spraying girl at Donald Trump rally,Fox News,2016-03-31
61377,83780,Van Susteren to host town hall with Trump ahead of Wisconsin primary,Fox News,2016-03-31
61378,83781,"’One shot at the queen’: FBI, AG intensify focus on Clinton email probe",Fox News,2016-03-31
61379,83782,"Clinton targets Trump in TV ad, as Sanders ups pressure",Fox News,2016-03-30
61380,83783,Deer hunters face unwanted competition as feral hog explosion thins herds,Fox News,2016-03-31
61381,83784,State Dept suspends review into ’top secret’ Clinton emails,Fox News,2016-04-01
61382,83787,Pro-Clinton group files DOJ report alleging Trump-Carson appointment deal,Fox News,2016-04-01
61383,83788,Will the rules survive a new progressive populist moment?,Fox News,2016-04-01
61384,83789,"Trump claims abortion remarks taken out of context, but admits ’it could be that I misspoke’",Fox News,2016-03-31
61385,83790,Miffed Maine governor refuses to swear in new senator,Fox News,2016-04-01
61386,83791,"Obama, leaders urge more action on nuclear security, terror ",Fox News,2016-04-01
61387,83792,"Seoul says North Korea fires short-range missile into sea, jams GPS signals",Fox News,2016-04-01
61388,83793,Obama says comments like Trump’s show ignorance about world,Fox News,2016-04-01
61389,83794,Krauthammer on Obama: He’s ’operating in a world that is detached from ours’,Fox News,2016-04-01
61390,83795,Obama: Global firms nervous about doing business in Iran,Fox News,2016-04-01
61391,83796,ISIS reportedly hijacks university’s chem lab for explosive experiments,Fox News,2016-04-01
61392,83797,New footage of Palmyra reveals ISIS destruction,Fox News,2016-04-01
61393,83798,"Police, terror task force probe motive of heavily-armed gunman who killed trooper",Fox News,2016-04-01
61394,83799,"Clinton, Sanders camps squabble over NY debate, latest in now contentious primary",Fox News,2016-04-02
61395,83801,Cruz turns to GOP convention rule to keep Kasich from nabbing nomination,Fox News,2016-04-02
61396,83802,Palin calls on Republicans to unify behind Trump candidacy at GOP dinner,Fox News,2016-04-02
61397,83804,Hollande’s ’Islamist terrorism’ omitted from White House vid; ’technical issue’ blamed,Fox News,2016-04-02
61398,83805,Cameron warns ISIS could use drones to spray nuclear material over Western cities,Fox News,2016-04-02
61399,83806,"US will ’hunt’ ISIS chief, ’he will taste justice,’ colonel vows",Fox News,2016-04-02
61400,83807,Tune in to FNC for ’Fox News Reporting: Rising Threats - Shrinking Military’,Fox News,2016-04-01
61401,83808,Video of military convoy new evidence Russia not pulling out of Syria,Fox News,2016-04-02
61402,83809,Children on Easter egg hunt form human arrow to direct British police to suspects,Fox News,2016-04-02
61403,83810,French authorities arrest 11 suspected neo-Nazis,Fox News,2016-04-02
61404,83811,"Trump regrets Heidi Cruz retweet, digs in on NATO and Asia nukes",Fox News,2016-04-03
61405,83813,"Candidates crisscross Wisconsin, where leaders Trump, Clinton stare down upsets",Fox News,2016-04-03
61406,83814,"Trump, Cruz take different paths Saturday but stay on the attack",Fox News,2016-04-03
61407,83815,"RNC’s Priebus tries to quell, clarify convention, pledge controversies",Fox News,2016-04-03
61408,83817,Bible charity vows to continue translation work after murders of four employees,Fox News,2016-04-03
61409,83818,Kenya to honor Muslim hero who protected Christian bus passengers,Fox News,2016-04-03
61410,83820,ISIS ’rocket expert’ responsible for death of US Marine is killed in airstrike,Fox News,2016-04-03
61411,83821,About 40 bodies reportedly found in mass grave in Palmyra,Fox News,2016-04-03
61412,83823,Islamic State group claims Saudi police station bombings,Fox News,2016-04-03
61413,83824,NH school angers parents after staying mum on dean’s arrest on drug charges,Fox News,2016-04-03
61414,83825,"Cruz reaches out to women voters, answers abortion questions on Fox exclusive",Fox News,2016-04-04
61415,83827,"Trump, Cruz pressure Kasich to exit GOP primary race",Fox News,2016-04-04
61416,83828,Trump faces new headaches in behind-scenes battle for delegates,Fox News,2016-04-04
61417,83829,Sanders campaign accuses Clinton of ducking debates as Wisconsin battle looms,Fox News,2016-04-04
61418,83830,Krauthammer: Trump’s abortion stumble shows how unprepared front-runner is,Fox News,2016-04-04
61419,83831,After a terrible week Trump sticks with style over substance in Wisconsin ,Fox News,2016-04-04
61420,83832,"Clinton, Sanders agree to Democratic debate in Brooklyn before New York primary",Fox News,2016-04-04
61421,83833,CSI: ISIS -- Terror group launches forensics division,Fox News,2016-04-04
61422,83834,At least 22 Islamic radicals linked to the Paris and Brussels attacks could still be at large,Fox News,2016-04-04
61423,83835,Syrian army presses ahead with offensive against ISIS,Fox News,2016-04-04
61424,83836,Wing bursts into flames after two planes collide on Indonesian runway,Fox News,2016-04-04
61425,83837,United Airlines flight attendant pulls emergency slide after plane lands at Houston airport,Fox News,2016-04-04
61426,83838,Inspiring 8th-grader refuses to calculate her BMI,Fox News,2016-04-04
61427,83839,6-year-old Texas runner with cerebral palsy defies odds to win medals,Fox News,2016-04-04
61428,83840,Mom’s smoking can alter fetus’ DNA,Fox News,2016-04-04
61429,83841,Teen asks 8-year-old neighbor battling cancer to prom,Fox News,2016-04-04
61430,83842,"Exit polls: Evangelicals surge to Cruz, independents lean Trump in Wisconsin",Fox News,2016-04-05
61431,83844,Sanders momentum pushes Obama to sidelines ,Fox News,2016-04-05
61432,83845,Walker: Wisconsin primary a ’turning point’; confident it’s Cruz vs. Clinton,Fox News,2016-04-05
61433,83846,"Trump backers want someone who will ’say or do anything,’ poll says",Fox News,2016-04-05
61434,83847,Clinton leads Sanders by 2.5 million voters--so who is more popular?,Fox News,2016-04-05
61435,83848,Carlson: Kasich ’a living embodiment of attitude that is going to cause problems’,Fox News,2016-04-05
61436,83849,"Feds set up fake university, arrest 21 in bogus visa case",Fox News,2016-04-05
61437,83850,"Duke University sit-in calls for $15 minimum wage, firings in race flap",Fox News,2016-04-04
61438,83851,Illinois couple defiant despite $80G fine for refusing gay union at B&B,Fox News,2016-04-05
61439,83852,Mississippi governor signs law allowing service denial to gay people,Fox News,2016-04-05
61440,83853,PepsiCo CEO asks North Carolina gov to repeal new law,Fox News,2016-04-03
61441,83854,Mississippi has taken a bold step to defend religious liberty,Fox News,2016-04-05
61442,83855,Ethics report: Florida Democrat Grayson likely violated House rules,Fox News,2016-04-05
61443,83856,California initiative calls for pols to wear NASCAR-style donor logos,Fox News,2016-04-06
61444,83858,"Sanders campaign talks up contested convention, despite long odds",Fox News,2016-04-06
61445,83859,"Wisconsin reset? After primary victory, Cruz claims ’turning point’ in GOP race",Fox News,2016-04-06
61446,83860,Trump campaign to Cruz: GOP establishment is using you,Fox News,2016-04-06
61447,83861,An open letter to Donald Trump from Ari Fleischer: Five things you need to do now,Fox News,2016-04-06
61448,83862,"’Staggering number’ of Europeans embraced jihad, many returning home, EU claims",Fox News,2016-04-06
61449,83863,Arizona college imposes mandatory fee to fund scholarship for illegal immigrants,Fox News,2016-04-06
61450,83864,"Illegal immigrant’s deadly crash not a ’crime of violence,’ ICE says",Fox News,2016-04-06
61451,83865,Local news storm trackers rescue man from wildfire as flames creep in,Fox News,2016-04-06
61452,83866,"Wildfire spares Oklahoma town, plant but still not contained",Fox News,2016-04-06
61453,83867,"Dems on FEC target conservatives, vote to punish maker of anti-Obama movie",Fox News,2016-04-07
61454,83869,"Federal appeals court slams IRS in Tea Party case, demands documents",Fox News,2016-03-24
61455,83870,How feasible is Trump’s proposed wall?,Fox News,2016-04-07
61456,83871,"Pro-life groups blast Kamala Harris over raid, charge conflict of interest",Fox News,2016-04-07
61457,83872,Biker who leds cops on 160 mph chase nabbed 4 months later,Fox News,2016-04-07
61458,83873,Dashcam video shows why Fort Worth cop pepper sprayed bikers,Fox News,2016-03-31
61459,83874,"Thousands of Iraq, Afghan war vets sickened after working at ’burn pits’",Fox News,2016-04-08
61460,83876,"Soldier who fought VA, blamed cancer on Iraq ’burn pits,’ dies",Fox News,2016-04-04
61461,83877,"Shadow battle for delegates turns to Colorado, Cruz holds edge",Fox News,2016-04-08
61462,83878,Race for Rubio’s seat heats up as Grayson bid poses challenge for Dems,Fox News,2016-04-08
61463,83879,Veterans’ charities reportedly receive fraction of money raised by Trump event,Fox News,2016-04-08
61464,83880,Sanders walks back criticism of Clinton qualifications,Fox News,2016-04-08
61465,83881,Court strikes down Wisconsin right-to-work law,Fox News,2016-04-08
61466,83882,Wisconsin shines light on Big Labor’s big money,Fox News,2016-04-05
61467,83883,Belgian prosecutors say ’man in the hat’ is terror suspect Mohamed Abrini,Fox News,2016-04-09
61468,83885,Belgium warns of more terror cells as police arrest sixth suspect in Brussels bombing,Fox News,2016-04-09
61469,83886,US Air Force deploys B-52 bombers in Middle East to combat Islamic State,Fox News,2016-04-09
61470,83887,"Sanders wins Wyoming Democratic caucuses, Cruz taking Colorado delegates",Fox News,2016-04-09
61471,83889,Sanders trip to Vatican conference causes dust-up,Fox News,2016-04-09
61472,83890,"New Jersey homeowner faces fine, jail for flying Donald Trump campaign flags",Fox News,2016-04-09
61473,83892,Navy rescues 3 castaways who wrote ’help’ with palm fronds on deserted island,Fox News,2016-04-09
61474,83893,Iran to US: Missile program ‘not open to negotiation’,Fox News,2016-04-10
61475,83895,Iran says  Boeing officials will visit Tehran soon,Fox News,2016-04-09
61476,83896,Iran to hold 3-day military drill,Fox News,2016-04-10
61477,83897,"Iran in Syria: flexing more, not less, military muscle",Fox News,2016-04-07
61478,83898,Trump aide Manafort accuses Cruz of ’gestapo tactics’ to win delegates,Fox News,2016-04-10
61479,83899,"Fox News Poll:  Trump holds huge lead in Pennsylvania, Clinton up over Sanders",Fox News,2016-04-10
61480,83900,"Fox News Poll:  Trump, Clinton rule Empire State",Fox News,2016-04-10
61481,83901,Boston Globe takes aim at potential Trump presidency with satirical front page ,Fox News,2016-04-10
61482,83902,"Sanders tempers NY as must win, Clinton, Trump teams still confident about winning nomination",Fox News,2016-04-10
61483,83903,Ohio officer in critical condition after being shot serving warrant,Fox News,2016-04-10
61484,83904,Oklahoma police hunt suspect who punched retired cop trying to break up fight,Fox News,2016-04-10
61485,83905,"Vietnam vet, 70, uses cane to foil Waffle House robbery",Fox News,2016-04-10
61486,83906,Danny Willett wins the 80th Masters after Jordan Spieth’s collapse,Fox News,2016-04-10
61487,83907,Smylie Kaufman surprising Masters contender _ to some,Fox News,2016-04-09
61488,83908,Police investigate whether ex-NFL defensive end Will Smith was killed out of revenge,Fox News,2016-04-11
61489,83909,Saints will induct Will Smith into their team Hall of Fame,Fox News,2016-04-11
61490,83910,"Pressure’s on Trump for big NY win, as Cruz, Kasich work the edges",Fox News,2016-04-11
61491,83911,"As Trump targets GOP process, speculation swirls around alternative candidates",Fox News,2016-04-11
61492,83912,Trump slams GOP nominating process as top aide accuses Cruz of ’gestapo tactics’ to win delegates,Fox News,2016-04-11
61493,83913,Just Trump? Boston Globe won’t say if fake front pages planned for other candidates,Fox News,2016-04-11
61494,83914,Ivanka and Eric Trump won’t be voting in NY GOP primary,Fox News,2016-04-11
61495,83915,"If Trump doesn’t understand 156-year-old rules, how will he understand the presidency?",Fox News,2016-04-11
61496,83916,Few airports require employee screening before work,Fox News,2016-04-11
61497,83917,"TSA under fire for spending $47,600 on app that points left or right",Fox News,2016-04-06
61498,83918,"Bible makes list of books most challenged at libraries, public schools",Fox News,2016-04-11
61499,83919,Tennessee lawmakers vote to make Bible official state book,Fox News,2016-04-04
61500,83920,Taxpayer info at risk from cyberattacks as Tax Day nears?,Fox News,2016-04-12
61501,83922,Colorado spends half million fighting for ’Amazon tax’ it can’t keep,Fox News,2016-04-01
61502,83923,Woman lost 9 days in Arizona forest wrote ’help’ in sticks,Fox News,2016-04-12
61503,83924,Rescuers find pair of skiers stranded on Alaska glacier for days,Fox News,2016-04-12
61504,83925,Fresh document trove sheds light on Clinton-Trump ties,Fox News,2016-04-12
61505,83926,"Hillary Clinton, NYC Mayor De Blasio draw criticism over racially-tinged joke at charity dinner",Fox News,2016-04-11
61506,83927,Clinton mocks subway mishap on website error page,Fox News,2016-04-12
61507,83928,Civil war-era wreck tentatively identified as blockade runner Agnes E. Fry,Fox News,2016-04-12
61508,83929,Why Neanderthals likely fathered few kids with modern humans,Fox News,2016-04-12
61509,83930,Clinton’s call for new immigration office draws fire,Fox News,2016-04-13
61510,83932,Sanders backers in full press to wrest superdelegates from Clinton,Fox News,2016-04-13
61511,83933,"Trump draws RNC rebuke over ‘rigged’ primary charge, missing key deadlines",Fox News,2016-04-13
61512,83934,"Trump, Megyn Kelly meet in New York",Fox News,2016-04-13
61513,83935,"US Marshals official sidelined amid misconduct probe, alleges ’political influence’",Fox News,2016-04-13
61514,83936,"Chicago police have ’no regard’ for minority lives, mayor’s task force says",Fox News,2016-04-13
61515,83937,Shooting probe puts Israel’s military courts in spotlight,Fox News,2016-04-13
61516,83938,’Pig Book’ finds earmark spending on the rise,Fox News,2016-04-13
61517,83939,Device harnessing thoughts allows quadriplegic to use his hands,Fox News,2016-04-13
61518,83940,Distracted driving clampdown: Cops could get ’textalyzers’,Fox News,2016-04-13
61519,83941,"Fox News Poll:  Trump widens lead in GOP race, Clinton-Sanders tightens",Fox News,2016-04-14
61520,83943,Fox News Poll: The electorate is in a mood,Fox News,2016-04-14
61521,83944,Ex-’Apprentice’ contestants to Donald Trump: We hope you’re fired!,Fox News,2016-04-14
61522,83945,Florida prosecutor won’t pursue charges against Trump aide,Fox News,2016-04-14
61523,83946,"Clinton campaign, Democratic Party sue Arizona over primary voting problems",Fox News,2016-04-14
61524,83947,It’s All Your Money: VA let costly equipment sit unused for months,Fox News,2016-04-14
61525,83948,Calif. couple charged with molesting at least 10 children,Fox News,2016-04-14
61526,83949,Ohio woman accused of livestreaming alleged rape of  teen friend,Fox News,2016-04-13
61527,83950,"Man accused of murdering Seattle-area mom abused former girlfriend, woman says",Fox News,2016-04-14
61528,83951,Board OKs parole for former Manson cult member Leslie Van Houten,Fox News,2016-04-14
61529,83952,Conviction stands for ex-NYPD officer in stairwell shooting,Fox News,2016-04-14
61530,83953,Police investigate ’suspicious’ disappearance of Washington couple,Fox News,2016-04-14
61531,83954,It’s all your money: US aiding business start-ups -- for illegal aliens,Fox News,2016-04-15
61532,83956,GOP leaders brace for new war of words over delegates ahead of Wyoming contest,Fox News,2016-04-15
61533,83957,Sanders’ Jewish outreach coordinator under fire after anti-Netanyahu rant,Fox News,2016-04-15
61534,83958,"Sanders gave 4 percent of income to charity in 2014, tax returns show",Fox News,2016-04-15
61535,83959,ABSCAM agents to FBI chief: Bureau’s ’reputation’ on the line in Clinton probe,Fox News,2016-04-15
61536,83960,"Obama, first lady pay $81,000 in taxes on $436,000 of income",Fox News,2016-04-15
61537,83961,Every member of Congress ought to be embarrassed by the 2016 ‘Pig Book’,Fox News,2016-04-14
61538,83962,Alabama college student cited for wearing empty gun holster on campus,Fox News,2016-04-15
61539,83963,Tiger kills zookeeper at Palm Beach Zoo,Fox News,2016-04-15
61540,83964,"Those who think meeting Sanders was political meddling should ’find a psychiatrist,’ Pope says",Fox News,2016-04-16
61541,83965,Sanders says he met with Pope Francis,Fox News,2016-04-16
61542,83966,Fiery GOP rhetoric about impeaching IRS chief rings hollow after decades of inaction on tax code reform,Fox News,2016-04-16
61543,83967,Insurgent Dem threatens to upset Pelosi ally in Md. Senate battle,Fox News,2016-04-16
61544,83969,Report: Saudis vow to sell US assets if Congress decides gov was involved in 9/11,Fox News,2016-04-16
61545,83970,"Donald Trump is right about NATO, alliance burden sharing",Fox News,2016-04-15
61546,83971,"US frees 9 Guantanamo prisoners, sends them to Saudi Arabia",Fox News,2016-04-16
61547,83972,Obama to decide on declassifying 9/11 documents within 60 days,Fox News,2016-04-13
61548,83973,Russian jet threatens U.S. reconnaissance aircraft,Fox News,2016-04-16
61549,83974,Michigan couple faces jail time over lost Dr. Seuss library book,Fox News,2016-04-16
61550,83975,Texas man ruled out as suspect in ambush shooting of deputy constable,Fox News,2016-04-15
61551,83976,Vandals deface veterans memorial in California,Fox News,2016-04-14
61552,83977,Homeland Security warns Windows PC users to uninstall Quicktime,Fox News,2016-04-17
61553,83979,University of California student claims he was kicked off Southwest Airlines flight for speaking Arabic,Fox News,2016-04-17
61554,83980,Student group calls University of New Mexico seal offensive,Fox News,2016-04-17
61555,83981,Student group demands UC Davis chancellor’s resignation over image scrubbing,Fox News,2016-04-17
61556,83982,UC Davis tried to wipe pepper spray news from search results,Fox News,2016-04-14
61557,83983,Search on for missing Virginia woman after abandoned car found at national park,Fox News,2016-04-17
61558,83984,"Washington couple believed murdered, suspects on the run, police say",Fox News,2016-04-18
61559,83985,Fugitive sought in Chicago murder arrested on US Navy base in Florida,Fox News,2016-04-17
61560,83986, Texas governor declares state of disaster in nine counties amid sweeping rainfall,Fox News,2016-04-18
61561,83988,Jab at Trump? McConnell ’optimistic’ about contested convention,Fox News,2016-04-18
61562,83989,"Sanders camp touts growing Latino support; crucial in NY, Calif. races",Fox News,2016-04-18
61563,83990,"Thousands of voters, including celebrities, register to wrong Calif. party",Fox News,2016-04-18
61564,83991,Report: Catholic parishioners seek federal fraud probe of Sanders’ wife for land deal,Fox News,2016-04-18
61565,83992,Dancing Donald Trumps banned from school talent show,Fox News,2016-04-18
61566,83993,Supreme Court justices seem divided on Obama immigration actions; Roberts the wild card,Fox News,2016-04-18
61567,83994,Gregg Jarrett:  Four things to know about Obama’s immigration plan and the Supreme Court,Fox News,2016-04-18
61568,83995,Couple who appeared on HGTV series ’Love It Or List It’ sues,Fox News,2016-04-18
61569,83996,’Tanked’ star wants to install an aquarium for the next President,Fox News,2016-04-15
61570,83997,"Dem tensions flare as superdelegates flock to Clinton, even in states Sanders won",Fox News,2016-04-19
61571,83998,Sanders sparks feud with Clinton camp over fundraising accusations,Fox News,2016-04-19
61572,83999,"Cruz accuses Trump of ’whining’ about delegate process, in feisty interview",Fox News,2016-04-19
61573,84000,Trump reportedly shakes up campaign ahead of big primaries,Fox News,2016-04-19
61574,84001,Report: Trump flying to campaign stops on expired plane registration,Fox News,2016-04-19
61575,84002,"Trump, Sanders, Cruz, Hillary and the real New York value -- chutzpah",Fox News,2016-04-18
61576,84003,"Red tape keeps Coast Guard’s night-vision equipment idle, says lawmaker",Fox News,2016-04-19
61577,84004,"Veteran, 108, decides to skip biplane flight so she can stay on solid ground",Fox News,2016-04-19
61578,84005,Video of Coast Guard’s $200 million cocaine bust off Panama released,Fox News,2016-03-29
61579,84006,Arrest of ’anti-racism’ graffiti vandal sparks uproar at University of Wisconsin,Fox News,2016-04-19
61580,84007,Student pleads guilty to making online threats toward Mizzou’s black community,Fox News,2016-04-19
61581,84008,Student expelled for racial slurs in video says he was quoting ’Django Unchained’,Fox News,2016-04-19
61582,84009,"Smart mattress will out your lying, cheating spouse",Fox News,2016-04-19
61583,84010,"Sanders, Cruz resist pressure after NY losses, vow to fight to conventions",Fox News,2016-04-20
61584,84012,"As convention nears, RNC meets but seems reluctant to make rules change",Fox News,2016-04-20
61585,84013,"Turmoil grips conservative Schlafly organization, amid Trump-Cruz tensions",Fox News,2016-04-20
61586,84014,"A big win in N.Y., but Trump also needs to fight a culture war",Fox News,2016-04-20
61587,84015,"Clinton, Trump hold strong leads in Connecticut, poll finds",Fox News,2016-04-20
61588,84016,Did they profit? Lawmakers clash over new documents in fetal tissue probe,Fox News,2016-04-20
61589,84017,"Russia ignores Obama’s plea for Syria ceasefire, shifts forces to Aleppo",Fox News,2016-04-20
61590,84018,Syria opposition figure says Assad has ’buried’ cease-fire,Fox News,2016-04-20
61591,84019,Activists say deal reached to evacuate besieged Syrians,Fox News,2016-04-20
61592,84020,Stossel: I have lung cancer. My medical care is excellent but the customer service stinks,Fox News,2016-04-20
61593,84021,Eating nuts linked to lower risk of colon cancer,Fox News,2016-04-20
61594,84022,"Bristol-Myers’ Opdivo extends survival in head and neck cancer, study finds",Fox News,2016-04-19
61595,84023,The case for making cancer a campaign issue,Fox News,2016-04-19
61596,84024,Pop superstar Prince dead at 57,Fox News,2016-04-21
61597,84026,Prince: 1958-2016,Fox News,2016-04-21
61598,84027,"Musicians, actors and celebrities react to news of Prince’s death",Fox News,2016-04-21
61599,84028,Fans say goodbye after Prince’s sudden death,Fox News,2016-04-21
61600,84029,"In Prince’s songs, an irresistible invitation to party",Fox News,2016-04-21
61601,84030,TMZ website crashes after Prince’s death,Fox News,2016-04-21
61602,84031,DR. MANNY: Was Prince’s flu care mishandled or did he have risk factors?,Fox News,2016-04-21
61603,84032,Some of Prince’s memorable performances,Fox News,2016-04-21
61604,84033,Is Bernie Sanders now running a who-cares campaign?,Fox News,2016-04-21
61605,84034,"Kasich calls out GOP for being negative, warns of November catastrophe",Fox News,2016-04-21
61606,84035,Cruz hits Trump for transgender remarks,Fox News,2016-04-21
61607,84036,"Clinton rails against big banks, but refuses to release Wall Street speeches",Fox News,2016-04-21
61608,84037,Trump ’chalking’ prompts hand-wringing at Wisconsin campus,Fox News,2016-04-21
61609,84038,Ivy Leaguers propose race-based student elections,Fox News,2016-04-21
61610,84039,"’Hijab Day’ divides students, faculty at top Paris university",Fox News,2016-04-21
61611,84040,Kelly Ripa will not return to ‘Live!’ until Tuesday,Fox News,2016-04-21
61612,84041,Michael Strahan is a no show at charity event he was set to host,Fox News,2016-04-21
61613,84042,Prince autopsy completed; singer’s body will be released to his family,Fox News,2016-04-22
61614,84044,Justin Bieber offends Prince fans with Instagram comment,Fox News,2016-04-22
61615,84045,"Awaiting Prince’s autopsy results: Experts say flu, opioid use can be deadly combination",Fox News,2016-04-22
61616,84046,Transcript of 911 call from Prince’s compound,Fox News,2016-04-22
61617,84048,Fox News Poll: Clinton ahead of Sanders by four in Indiana,Fox News,2016-04-22
61618,84049,Fox News Poll:  Trump tops Cruz by eight points in Indiana,Fox News,2016-04-22
61619,84050,"Fox News Poll: Trump leads in California, Clinton-Sanders in close race",Fox News,2016-04-22
61620,84051,"Threats, pressure on delegates could put Cruz’s convention hopes at risk",Fox News,2016-04-22
61621,84052,"Clinton gave paid speeches to firms that lobbied, contracted with government",Fox News,2016-04-21
61622,84053,Starnes: Donald Trump is not a conservative,Fox News,2016-04-22
61623,84054,2016 insiders talk a big game – but their records in Congress are thin,Fox News,2016-04-22
61624,84055,Trump surrogates say GOP front-runner ’projecting an image’ during primaries,Fox News,2016-04-21
